idiom_0,instance_0,label_0,meaning_0,idiom_1,instance_1,label_1,meaning_1,idiom_2,instance_2,label_2,meaning_2,idiom_3,instance_3,label_3,meaning_3,idiom_4,instance_4,label_4,meaning_4
second wind,"after a short break, the marathon runner found a second wind and continued running",0,another burst of energy when you had been too tired to finish,ring fencing,the company decided to ring fencing the funds for the research department,0,to create a separate legal entity through the way of off-shore accounting in order to protect some assets in a corporation,hand in hand,success and hard work walked hand in hand in her life,0,close ties or connections,let the cat out of the bag,he accidentally let the cat out of the bag about the surprise party,0,to let a secret out in the open,bare bones,the archaeologist presented the bare bones of the ancient skeleton,1,most basic and important elements or facts
sit on the fence,"when it came to choosing a side, he was always sitting on the fence",0,delay or avoid making a decision or choice,bite off more than one can chew,"by accepting too many projects at once, he bit off more than he could chew",0,"to try to do something that is too difficult for you, or more than you can manage",first light,"the sun began to rise, and we could see at first light the beautiful landscape",1,the time when the light begins to appear in the morning,apple polisher,he got the promotion by being an apple polisher and constantly flattering the boss,0,a flatterer; toady,wet the baby's head,"after the birth of their child, they invited friends over to wet the baby's head with a small celebration",0,to have drink to celebrate the birth of a baby
ready to drop,"after working for 12 hours straight, he looked ready to drop",0,to be extremely tired and nearly too exhausted to stay standing,on pins and needles,"during the acupressure therapy session, she was waiting on pins and needles placed on her back",1,being anxious or nervous,got somebody's goat,her constant teasing finally got his goat and he lost his temper,0,to annoy or irritate someone,wash hands of,"after trying to help for months, they finally washed their hands of the situation and moved on",0,abandon taking responsibility for someone or something,rabbit hole,"researching the topic, I went down the rabbit hole of conspiracy theories",0,mentally go somewhere surreal or strange
bright spark,"she was a bright spark in the team, always coming up with innovative ideas",0,an intelligent and lively person (humorously),foot in mouth,I put my foot in my mouth when I accidentally insulted her cooking,0,to say something by accident that embarrasses or upsets someone,bread and butter,"graphic design is their bread and butter, as it's their main source of income",0,to indicate what a person earns or earns for,back against the wall,"with no other options left, he had his back against the wall and had to make a decision",0,to be in a tough situation with limited options,a wet blanket,"after the rainstorm, the picnic blanket was being a wet blanket on the ground",1,a person who spoils other people's fun.
do the trick,"adding a little more salt to the soup, that should do the trick",0,successfully achieve a result,go round in circles,the team was going round in circles trying to solve the problem,0,work at something but keep failing to make progress with it.,jam on your face,"while eating breakfast, he accidentally had jam on his face from the toast",1,"people who appear to be caught, embarrassed or found guilty",just off the boat,"he was so naive and inexperienced, as if he was just off the boat",0,a person who is naive and inexperienced,tore your hair out,you accidentally tore your hair out while removing the tangled hairbrush,1,to be extremely agitated or distressed about something
to the core,the powerful earthquake had shaken to the core of the Earth,1,totally,wrapped up in cotton wool,she was always wrapped up in cotton wool by her overprotective parents,0,to be over-protected from dangers and risks,in hot water,he found himself in hot water after forgetting to submit the report on time,0,in trouble or state of shame,on pins and needles,"while anticipating the exam results, we were waiting on pins and needles",0,being anxious or nervous,smooth his ruffled feathers,the bird handler had to smooth his ruffled feathers before the photoshoot,1,to make someone feel less angry or offended
feel the pinch,"after losing his job, he started to feel the pinch financially",0,experience financial hardship,lose it,she lost it during the meeting when her pen slipped out of her hand,1,go insane or crazy,rats in the attic,"when they went up to clean, they found rats in the attic",1,someone who is bit mad or that their behaviour is eccentric,put the clock back,"due to daylight saving time, we had to put the clock back an hour",1,change to a lower level or earlier time.,make ones bed and lie on it,they made their bed and lied on it when they decided to invest in that risky business,0,to be responsible for what you have done and accept the results
in touch,"even after moving to another city, we promised to stay in touch",0,"to remain in contact with someone, especially when separated by time or distance",cost an arm and a leg,the designer dress she wanted cost an arm and a leg,0,very expensive,drive a wedge between,the lumberjack used a mallet to drive a wedge between them and split the log,1,to damage the good relationship that two people or groups of people have,lie low,"during the game of hide and seek, he decided to lie low in the tall grass",1,"To go out of sight, usually after having done something bad.",recharge one's batteries,they plugged in their devices to recharge their batteries before leaving the house,1,take a break or holiday to relax and regain one's vim and vigour
out of business,the new competitor put them out of business by offering lower prices,0,out of operational conditions,feather in your cap,winning the championship would be a feather in your cap,0,It means to have an achievement in your name.,smooth sailing,"on a calm day at sea, the boat would experience smooth sailing without any turbulence",1,easy progress without impediment or difficulty,back to the salt mines,the miners finished their lunch break and were going back to the salt mines to continue their work,1,"resume work, usually with some reluctance",piss and vinegar,the container was accidentally full of piss and vinegar after a mix-up at the factory,1,to self-reference someone who is in a bad mood and ready to fight.
fill the bill,the waiter filled the bill perfectly with all the items we ordered,1,be exactly suitable for a particular situation,camp follower,"he was known as a camp follower, always supporting the team but never participating",0,"a person who is supportive of the cause, person or organisation",drop a bombshell,the clumsy actor accidentally dropped a bombshell during the meeting while filming a war scene,1,"make an unexpected, startling or disturbing announcement",bright spark,the firework display created a bright spark in the night sky,1,an intelligent and lively person (humorously),off the hook,"after untangling the fishing line, we managed to let him off the hook",1,free of a difficult situation
down to earth,"the astronaut, once back from space, became a down-to-earth person again",1,"decent, simple, realistic",stop by,"during our walk, we decided to stop by the store to take shelter from the sudden downpour",1,to meet someone or go somewhere in a brief and informal manner,wipe the slate clean,"after a long discussion, they wiped the slate clean together and started fresh",0,"to make a fresh start and forget all past offences, disagreements or mistakes",wheels fall off,"due to a manufacturing defect, the wheels fell off the toy car",1,when a situation gets out of control and everything starts to go wrong,fingers and thumbs,the hand puppet was all fingers and thumbs with no other features,1,to be clumsy and not very skilled with your hands
every nook and cranny,"during the deep cleaning, they searched every nook and cranny of the house for dust and dirt",1,to look for something everywhere,straighten up and fly right,the pilot had to straighten up and fly right to avoid turbulence,1,to get serious and stop acting absurd anymore.,look before you leap,"when making a big decision, always remember to look before you leap",0,to make sure that everything is alright before doing something important which you cannot revert,asleep at the wheel,the manager was asleep at the wheel when the company lost a major client,0,"when someone is not sufficiently attentive, especially at a critical moment when vigilance is required",red herring,"while exploring the fish market, we found a red herring among the seafood",1,something irrelevant that distracts you from something important
apples to apples,"to make a fair judgment, we need to compare apples to apples in this situation",0,having a fair comparison between the two things,come full circle,"after years of exploring different career paths, she came full circle and returned to her passion for teaching",0,return to an earlier position or decision.,suited and booted,"he was suited and booted for the event, wearing a tailored suit and polished shoes",1,formally dressed; well dressed,turn the tables,"during the furniture rearrangement, they turned the tables on her to make more space",1,change your position with respect to someone else.,chill to the bone,"after being outside in the freezing weather, we were chilled to the bone",1,to get frightened or scare somebody
bits and pieces,"after the meeting, we gathered the bits and pieces of information to create a report",0,miscellaneous small objects,just deserts,"after cheating on the test, they received their just deserts when they were caught",0,get what one deserves,on the crest of a wave,"after the successful product launch, the company was riding on the crest of a wave",0,to reach the highest point of success,water under the bridge,"despite their past disagreements, they decided to let it be water under the bridge and move forward",0,past events that are not important anymore,"Mr Right, Ms Right","at the costume party, they found their Mr Right and Ms Right outfits in the store",1,the best future life partner for someone
between a rock and a hard place,he was caught between a rock and a hard place when he had to choose between his job and his family,0,having two very bad choices,a witch hunt,the company started a witch hunt to find the person responsible for the leak,0,an attempt to find and punish people whose opinions are unpopular and who are said to be a danger to society,spin a yarn,they spun a yarn together about their adventurous trip to the mountains,0,to tell a tale,blind spot,he had a blind spot when it came to recognizing his own flaws,0,"if you have a blind spot about something, you cannot accept or understand it",mend fences,"after the argument, he started mending fences with her by apologizing",0,to try and improve a bad relationship with another party
