idiom,meaning,example,tag
calendar year,"a period of twelve months, usually from January 1 to December 31.","According to the briefing the main areas of broad agreement , as specified by the evolving joint US-Soviet draft treaty texts , were : ( i ) a 1,600 numerical ceiling on the total number of "" strategic nuclear delivery vehicles ' ( SNDVs ) , comprising intercontinental ballistic missiles ( ICBMs ) , submarine-launched ballistic missiles ( SLBMs ) and heavy bomber aircraft ; ( ii ) a 6,000-warhead overall ceiling ; ( iii ) a set of basic verification procedures including exchange of data , on-site inspection and ongoing monitoring of agreed reductions and the right to inspections at short notice of a variety of specified sites ; ( iv ) the provision of advance notification of one major strategic exercise involving heavy bombers per calendar year ; ( v ) the permitting of mobile ICBM deployment , contingent upon US congressional funding of the MX ( rail-based ) and/or the Midgetman ( road-based ) systems ( as announced in Wyoming , USA , in September 1989-see p. 36909 ) , with sub-limits to be agreed ; and ( vi ) the de-linking of completion and implementation of a START treaty from a "" Space and Defence "" agreement , implying an end ( conditionally for the Soviet Union ) to a commitment by the two sides not to withdraw from the ( 1972 ) Anti-Ballistic Missile ( ABM ) treaty ( an agreement also reached in Wyoming-ibid . ) .",O O O O O O O O O O O O O O O O O O O O O O O O O O O O O O O O O O O O O O O O O O O O O O O O O O O O O O O O O O O O O O O O O O O O O O O O O O O O O O O O O O O O O O O O O O O O O O O O O O O O O O O O O O O O O O O O O O O O O O O O O O O O O O O B-IDIOM I-IDIOM O O O O O O O O O O O O O O O O O O O O O O O O O O O O O O O O O O O O O O O O O O O O O O O O O O O O O O O O O O O O O O O O O O O O O O O O O O O O O O O O O O O O O O O O O O O O O O O O O O O O O O O O O O O O O O O O O O
call [pron] names,insult or criticize someone in a rude or demeaning way.,I remember this time after school there was a fight between blacks and whites ; I went and stayed in the toilets for a half-hour thinking what I should do and that 's when I really took a look at myself and thought about the white kids calling me names and the black kids saying ‘ come on ’ so I said ‘ all right ’ .,O O O O O O O O O O O O O O O O O O O O O O O O O O O O O O O O O O O O O O O O O O O O O O O B-IDIOM I-IDIOM I-IDIOM O O O O O O O O O O O O O O O O O
call [pron] shots,have control over a situation or decision-making process.,"The cinema debate screened on Channel 4 between four film-makers from countries not usually represented on the screen ( India , the Philippines , Lebanon , and Brazil ) , which took place under the auspices of Women Call the Shots , was perhaps especially effective in this way , not only because it called attention to the existence of cinematic traditions outside of the ones we usually view , discuss , and study , but also because the four women film-makers involved in the debate took up such diverse positions .",O O O O O O O O O O O O O O O O O O O O O O O O O O O O O O O O O O O O O O B-IDIOM I-IDIOM I-IDIOM O O O O O O O O O O O O O O O O O O O O O O O O O O O O O O O O O O O O O O O O O O O O O O O O O O O
call [pron] spade [pron] spade,"tell it like it is, speak honestly and directly about a situation.","This may be caused to some extent by the general abstractness of the language ; but it is also a matter of the kinds of syntactic presentation and complexity that James favours : ( i ) Just as he seems to avoid calling a spade a spade , so James seems to avoid putting first things first .",O O O O O O O O O O O O O O O O O O O O O O O O O O O O O O O O O O O O O O O O O O B-IDIOM I-IDIOM I-IDIOM I-IDIOM I-IDIOM O O O O O O O O O O O
call [pron] tune,allow someone to make all the decisions.,"British trade union leaders were , it seemed , being called upon to pay the piper when they were not even being allowed to call the tune .",O O O O O O O O O O O O O O O O O O O O O O O O B-IDIOM I-IDIOM I-IDIOM O
canteen culture,"a workplace culture that is informal and relaxed, where employees are encouraged to socialize and interact with each other.","What is more important than gender is the personality and skill of the fieldworker in overcoming the feelings of suspicion the police have of all outsiders , especially in the more enclosed and threatened world of the RUC , and in our case the field-worker 's gender seemed no bar to her obtaining access to the masculine ‘ canteen culture ’ of the men or to participating in conversations on the topics which are popular in that culture , which van Maanen describes as ‘ sports , cars and sex ’ ( 1981 : 476 ) .",O O O O O O O O O O O O O O O O O O O O O O O O O O O O O O O O O O O O O O O O O O O O O O O O O O O O O O O O O O B-IDIOM I-IDIOM O O O O O O O O O O O O O O O O O O O O O O O O O O O O O O O O O O O O O
carpe diem,seize the day; make the most of the present moment.,"From one interpretative angle , Chaucer makes the axioms and ethics of the fabliau models — the availability of beautiful women and their longing for fornication ; the exaltation of practical cunning in the French fabliaux or the carpe diem theme of Dame Sirith — turn into a tale of prostitution with the deception of an undeserving husband who gains sympathy rather than scorn .",O O O O O O O O O O O O O O O O O O O O O O O O O O O O O O O O O O O O O O B-IDIOM I-IDIOM O O O O O O O O O O O O O O O O O O O O O O O O O
carrot and stick,a method of motivation that combines rewards (carrots) with punishments (sticks) to encourage desired behavior.,"( e ) Staff Two particular matters , in the nature of carrot and stick , may conveniently be mentioned here as being important for the partners to determine as a matter of firm policy : ( 1 ) r7 of the Solicitors ' Practice Rules 1990 permits solicitors to share their profits with their bona fide employees so long as such arrangements do not conceal an effective partnership .",O O O O O O O O O O O O B-IDIOM I-IDIOM I-IDIOM O O O O O O O O O O O O O O O O O O O O O O O O O O O O O O O O O O O O O O O O O O O O O O O O O O O O O O O
carry [pron] ball,"take responsibility for something, especially when others are not willing to do so.","Retiring players will not be penalised if their failure to retire 10 metres is due to the rapidity with which the kick has been taken , but they may not stop retiring and enter the game until an opponent carrying the ball has run five metres ’ .",O O O O O O O O O O O O O O O O O O O O O O O O O O O O O O O O O O O O O O O B-IDIOM I-IDIOM I-IDIOM O O O O O O
cash cow,a business or product that generates a steady and reliable income.,The discussion of the use of the portfolio goals in chapter 4 made it quite clear that SBUs labelled ‘ stars ’ will have quite different financial profiles from ‘ cash cows ’ or ‘ dogs ’ .,O O O O O O O O O O O O O O O O O O O O O O O O O O O O O O B-IDIOM I-IDIOM O O O O O O
castles in the air,have unrealistic ideas or plans that are unlikely to come true.,"After observing the industrious building of castles in the air in the past few days , I thought it would be appropriate to look at an odd phenomenon that has puzzled meteorologists for the past ten years : the series of giant mushroom-shaped cloud formations round the periphery of the Siberian land-mass .",O O O O O O B-IDIOM I-IDIOM I-IDIOM I-IDIOM O O O O O O O O O O O O O O O O O O O O O O O O O O O O O O O O O O O O O O O O O O O
cat burglar,"a thief who steals items of value from buildings, usually by entering through a window or other opening.","Michael Caine stars as cat burglar Henry Clarke , a master jewel thief who has himself committed to a sanatorium for alcoholics to gain the confidence of a multi-millionaire .",O O O O B-IDIOM I-IDIOM O O O O O O O O O O O O O O O O O O O O O O O O
catch [pron] eye,attract someone's attention.,"This was an ingenious wheelchair attached to the front of a bicycle ; and lastly as I left , I had a word with Stefan Sielaff from Germany , who had designed a fantastic three-wheeled single seater vehicle in fibreglass , that was catching everyone 's eye !",O O O O O O O O O O O O O O O O O O O O O O O O O O O O O O O O O O O O O O O O O O O B-IDIOM I-IDIOM I-IDIOM I-IDIOM O
caught in the crossfire,being in a situation where two opposing forces are in conflict and one is unintentionally harmed by the conflict.,They have been caught in the crossfire of this particular Serbo-Croat war and have responded by fighting against the Serbs whose reservist soldiers in the Mostar barracks have behaved atrociously over the past six months .,O O O B-IDIOM I-IDIOM I-IDIOM I-IDIOM O O O O O O O O O O O O O O O O O O O O O O O O O O O O O
charity begins at home,one should take care of their own family and friends before helping others.,"Though some newspapers like the Mail and the Express harped on the theme of ‘ charity begins at home ’ , the general line was to stress the potential benefits of taking in such ‘ lively , sturdily-built and intelligent ’ children .",O O O O O O O O O O O O O O O B-IDIOM I-IDIOM I-IDIOM I-IDIOM O O O O O O O O O O O O O O O O O O O O O O O O
cheek by jowl,"very close together, side by side.","The differences are deep and go far back into history , but while I have been a Minister dealing with the economy and the environment I have always had the greatest possible collaboration from all the parties in Northern Ireland , which have always worked cheek by jowl with one another and with me for the benefit of all the people of Northern Ireland .",O O O O O O O O O O O O O O O O O O O O O O O O O O O O O O O O O O O O O O O O O O O O O B-IDIOM I-IDIOM I-IDIOM O O O O O O O O O O O O O O O O O
chew [pron] cud,think deeply and reflect on something.,"The subject under discussion is that old chestnut , public or private financing of the arts , but there is a particularly exciting line-up of speakers to chew the cud .",O O O O O O O O O O O O O O O O O O O O O O O O O O O B-IDIOM I-IDIOM I-IDIOM O
chew [pron] fat,engage in a friendly conversation with someone.,"Following its fellow Motorola Inc 88000 travellers , Dolphin Server Technology AS ( UX No 376 ) and Harris Corp 's computer division ( UX No 380 ) , Data General Corp — which admits to having chewed the fat over alternative RISCs , but has decided to stick with the 88000 series ( UX No 376 ) — is expected to announce its own plans for systems based upon the next generation 88110 shortly , likely to include a complete re-haul of its existing AViiON workstation and server series .",O O O O O O O O O O O O O O O O O O O O O O O O O O O O O O O O O O O O O B-IDIOM I-IDIOM I-IDIOM O O O O O O O O O O O O O O O O O O O O O O O O O O O O O O O O O O O O O O O O O O O O O O O O O O O
chicken feed,"a small amount of money, usually considered insignificant.",The man with golden goal touch at the County Ground is still Craig Maskell … the two hundred and fifty thousand pounds that Swindon gave Reading for him is beginning to look chicken feed … 15 goals this season … the last two came last week against Southend … tomorrow he 's off to Ashton gate to shoot Bristol City down …,O O O O O O O O O O O O O O O O O O O O O O O O O O O O O O O O B-IDIOM I-IDIOM O O O O O O O O O O O O O O O O O O O O O O O O O O O O
chicken out,to back out of something due to fear or lack of courage.,"What if he had not left yet — she could ring him and tell him she 'd chickened out , and he could flap his wings and tease her but at least she would not have to — oh , hell , here he is , she thought , and watched as the huge bike rolled to a halt and he switched off the engine and hauled it up on the stand .",O O O O O O O O O O O O O O O O O B-IDIOM I-IDIOM O O O O O O O O O O O O O O O O O O O O O O O O O O O O O O O O O O O O O O O O O O O O O O O O O O O O O O
clock out,to finish work for the day and leave the workplace.,"so she said I , I went in and I said to Geraldine I 'm going I owe you any bloody money take the bugger out me wages , she says I am not having people that I like being stabbed like that by people like that , she said she is not worth the salt of the earth , she 's the salt of the earth she said with people like that pointing to Jenny and Jane , no way , she said and I 'm going with my mates , I turned round and the next thing Janet and Janet and Barbara in there , when we got up the pub at twelve o'clock , course we were all having sandwiches me and Pam got the , me and er Barb got there , then Pam come in then a few more come and erm then the plumber and all that come in with them and I said oh girls we never clocked out , so I said oh well I 'm going to have to take my key back to Steve , burst out laughing , so I said oh no I said why do not we have a key cracking competition so of course that 's what we did we all took our keys out of our bag and we went ready for she 's a jolly good ready , steady , fellow , for she 's go and we cracked these ruddy keys and shoved them up in the air",O O O O O O O O O O O O O O O O O O O O O O O O O O O O O O O O O O O O O O O O O O O O O O O O O O O O O O O O O O O O O O O O O O O O O O O O O O O O O O O O O O O O O O O O O O O O O O O O O O O O O O O O O O O O O O O O O O O O O O O O O O O O O O O O O O O O O O O O O O O O O O O O O O O O O O O O O O O O O O O O O O O O B-IDIOM I-IDIOM O O O O O O O O O O O O O O O O O O O O O O O O O O O O O O O O O O O O O O O O O O O O O O O O O O O O O O O O O O O O O O O O O O O O O O O O O O O O O O O O O O O O O O O O O
close call,"a situation in which something almost happened, but did not.","She then launched into an account so detailed that Johnson said to Boswell , ‘ All this should be written down , ’ and Boswell did , in a faithful rendition that traces every move made by the prince and those who wished him to escape — every hardship , close call and incident , every hope , frustration and despair .",O O O O O O O O O O O O O O O O O O O O O O O O O O O O O O O O O O O O O O O O O O O O O O O O O O B-IDIOM I-IDIOM O O O O O O O O O O
close to home,something that is personally relevant or meaningful.,"Academic studies have confirmed the obvious : events make news if they are clear , unusual , unexpected or unpredict-able ; if they fit a medium 's cycle ( a daily paper , for example , or an hourly news bulletin ) ; if they involve well known people or groups , places or countries ; if they are close to home ( literally or figuratively ) ; if they are negative ( accidents ) or reach a certain volume ( in terms of numbers hurt , for example , or goals scored ) .",O O O O O O O O O O O O O O O O O O O O O O O O O O O O O O O O O O O O O O O O O O O O O O O O O O O O O O O O O O O B-IDIOM I-IDIOM I-IDIOM O O O O O O O O O O O O O O O O O O O O O O O O O O O O O O O O O
cloud nine,a state of extreme happiness or elation.,"However , it will really be the New Moon on the 19th which provides you will a new romantic interest and just as long as you do not try to manipulate , control or dominate , you could well be on cloud nine .",O O O O O O O O O O O O O O O O O O O O O O O O O O O O O O O O O O O O O O O O O B-IDIOM I-IDIOM O
cock and bull story,an unbelievable or far-fetched story.,"The second expression for which I have traced the origin is ‘ a cock and bull story ’ , which originated in the Bedfordshire village of Stoney Stratford , where the two most popular public houses were The Cock and The Bull .",O O O O O O O O O O O O O B-IDIOM I-IDIOM I-IDIOM I-IDIOM O O O O O O O O O O O O O O O O O O O O O O O O O O
come clean,"to confess the truth, especially after having lied or kept something hidden.","She wondered , as she washed the dishes and Memet lay on the sofa with his feet on the cushions , whether some ancient warlock had ever discovered a truth drug while digging around among his herbs in the dark of the moon or even whether there was not some artificial chemical compound which would produce the same result and cause her lover to come clean about his dealings with women .",O O O O O O O O O O O O O O O O O O O O O O O O O O O O O O O O O O O O O O O O O O O O O O O O O O O O O O O O O O O O O O O O B-IDIOM I-IDIOM O O O O O O
come from behind,to achieve success after being in a difficult or losing position.,"Wolves may not howl here in the moonlight , as they did in the journal of Jonathan Harker , but I have no difficulty in seeing Slains as he saw Count Dracula 's castle in Bukovina , the tall black windows from which not a glimmer of light came , and the jagged battlements glimpsed when the moon came out from behind the fitful clouds .",O O O O O O O O O O O O O O O O O O O O O O O O O O O O O O O O O O O O O O O O O O O O O O O O O O O O O O O O O O B-IDIOM I-IDIOM I-IDIOM I-IDIOM O O O O
come hell or high water,no matter what obstacles or difficulties arise.,"The 8100 is the more compelling indicator of what might happen to OS/2 2.0 : IBM spent so much money developing both the hardware and a completely new operating environment and set of compilers and utilities for the thing that it had to recoup its investment , come hell or high water , before it could be killed off , despite the fact that within a couple of years , it became clear that what users wanted as a distributed processor was the machine that eventually appeared — fatally too late — as the 9370 .",O O O O O O O O O O O O O O O O O O O O O O O O O O O O O O O O O O O O O O O O O O O O O O O B-IDIOM I-IDIOM I-IDIOM I-IDIOM I-IDIOM O O O O O O O O O O O O O O O O O O O O O O O O O O O O O O O O O O O O O O O O O O O O
come of age,reach adulthood and the associated privileges and responsibilities.,"János Hunyadi was regent of Hungary during the minority of King Ladislas V , but had to step down at the very moment of the fall of Constantinople when Ladislas came of age .",O O O O O O O O O O O O O O O O O O O O O O O O O O O O O O B-IDIOM I-IDIOM I-IDIOM O
come out of [pron] closet,"acknowledge one's true identity, especially when it is different from what was previously assumed or publicly known.","While at the same time as not merely coming out of the closet about his sexuality — in fact , by hardly admitting there was a closet there at all — he was also locking so many of his innermost thoughts away .",O O O O O O O O B-IDIOM I-IDIOM I-IDIOM I-IDIOM I-IDIOM O O O O O O O O O O O O O O O O O O O O O O O O O O O O O O
come out of [pron] woodwork,"to suddenly appear or become known, especially after a period of obscurity or inactivity.","‘ But , ’ Frick went on , ‘ if we are to take our rightful place in history , then it 's time we came out of the woodwork . ’",O O O O O O O O O O O O O O O O O O O O O O O O O B-IDIOM I-IDIOM I-IDIOM I-IDIOM I-IDIOM O O
come rain or shine,"no matter what the circumstances, something will happen.","From childhood to grave , come rain or shine , joy or sorrow , but for a miracle , you yourself would have worn such garb to keep out the cold , the heat and the rain .",O O O O O B-IDIOM I-IDIOM I-IDIOM I-IDIOM O O O O O O O O O O O O O O O O O O O O O O O O O O O O O
come to [pron] attention,pay close attention to someone or something.,9.1.3 undertakes that it will promptly disclose to the other Parties and to the Secretary of State any facts or circumstances which come to its attention indicating or suggesting any infringement or material risk of infringement of any patent or other Intellectual Property Right of any other person not being a Party to this Agreement through the expected mode of use or exploitation of its own results or background provided always that this undertaking shall not be deemed to impose or imply any specific obligation to undertake any patent searches of intellectual property rights or make any enquiries .,O O O O O O O O O O O O O O O O O O O O O O B-IDIOM I-IDIOM I-IDIOM I-IDIOM O O O O O O O O O O O O O O O O O O O O O O O O O O O O O O O O O O O O O O O O O O O O O O O O O O O O O O O O O O O O O O O O O O O O O O O O O
come to [pron] head,reach a climax or point of resolution.,"A massive industrial crisis came to a head in late 1991 and early 1992 with widespread industrial unrest in some areas as Spain began to restructure its loss-making steel , coal , shipbuilding and other sectors and withdraw subsidies in preparation for the EC single internal market in 1993 .",O O O O B-IDIOM I-IDIOM I-IDIOM I-IDIOM O O O O O O O O O O O O O O O O O O O O O O O O O O O O O O O O O O O O O O O O O O
come to blows,engage in physical violence.,"The fifty percent share holding has worked well , because what it means no one person can impose their will , no one has control , you have to resolve problems by agreement , resolve disagreements without coming to blows .",O O O O O O O O O O O O O O O O O O O O O O O O O O O O O O O O O O O O O B-IDIOM I-IDIOM I-IDIOM O
come to fruition,come to a successful conclusion.,"One suspects that it is to demonstrate what the attractions of the famous Museum Island will be when the plan favoured by the Berlin museums supremo Dube but hotly contested by many museum professionals comes to fruition , for Dube has decided that the island is to be dedicated entirely to these archaeological collections , while the fine arts all move over to the western side of the city to more modern museums .",O O O O O O O O O O O O O O O O O O O O O O O O O O O O O O O O O O B-IDIOM I-IDIOM I-IDIOM O O O O O O O O O O O O O O O O O O O O O O O O O O O O O O O O O O O O O
come to terms with,accept and adjust to a difficult situation.,"Hack weaves objects and memorabilia from her past , the images are loaded with autobiographical references as the artist retraces the steps of her ancestors and comes to terms with her own past .",O O O O O O O O O O O O O O O O O O O O O O O O O O B-IDIOM I-IDIOM I-IDIOM I-IDIOM O O O O
come true,happen as expected or hoped for.,"In the meantime , the lads bludgeon out wodges of cacophonous , shapeless noise , like ‘ Waiting For The Wolves ’ and ‘ Hope Your Dreams Come True ’ , which revel in being unlistenable squalls far away from the succinct migraine catchiness of that hit single .",O O O O O O O O O O O O O O O O O O O O O O O O O O O B-IDIOM I-IDIOM O O O O O O O O O O O O O O O O O O O O
come under fire,"be criticized or attacked, especially in a public way.","Less than a year later Rust and Sabrina were on a routine stakeout at the Marseilles docks when they had come under heavy fire from a gang of drug smugglers and Rust was hit in the spine , leaving him paralysed from the waist down .",O O O O O O O O O O O O O O O O O O O O B-IDIOM I-IDIOM I-IDIOM I-IDIOM O O O O O O O O O O O O O O O O O O O O O O
come what may,no matter what happens.,"At the end of March , the Crown Prince and his Chief-of-Staff , von Knobelsdorf , were still dedicated to the capture of Verdun , come what may ; equally , Falkenhayn was still true ( in his indecisive fashion ) to his aim of bleeding the French Army to death at Verdun , regardless of whether or not the city fell in the process .",O O O O O O O O O O O O O O O O O O O O O O O O O B-IDIOM I-IDIOM I-IDIOM O O O O O O O O O O O O O O O O O O O O O O O O O O O O O O O O O O O O O O
company man,a person who is loyal to their employer and willing to do whatever is asked of them.,"Though the Company is still evil and still tends to give its spacecraft Conradian names ( 'Sulaco' this time , instead of ‘ Nostromo ’ , suggesting that someone other than Ridley Scott had actually read Nostromo , the devious company man , Burke ( Paul Reiser ) , is now the loner , and he behaves exactly like a Hollywood executive , or agent , intent on a deal .",O O O O O O O O O O O O O O O O O O O O O O O O O O O O O O O O O O O O O O O O B-IDIOM I-IDIOM O O O O O O O O O O O O O O O O O O O O O O O O O O O O O
cost [pron] arm and [pron] leg,be very expensive.,"When his or her car was not being illegally clamped , stolen , broken into , photographed by a Gatso camera or failing the MoT emissions test , it was costing an arm and a leg to insure .",O O O O O O O O O O O O O O O O O O O O O O O O O O O O O O B-IDIOM I-IDIOM I-IDIOM I-IDIOM I-IDIOM I-IDIOM O O O
couch potato,a person who spends a lot of time sitting around and watching television.,"Couch potatoes can run the London Marathon , take an in-depth reccy around St Paul 's , and do nine rounds with Chris Eubank , all while tucking into a freshly-delivered deep-pan !",B-IDIOM I-IDIOM O O O O O O O O O O O O O O O O O O O O O O O O O O O O O O O
cream of the crop,the best of a group or collection.,"He has always turned out teams who , until recently , were the cream of the crop in terms of style .",O O O O O O O O O O O O O B-IDIOM I-IDIOM I-IDIOM I-IDIOM O O O O O
cross [pron] fingers,hope for the best.,"They find out that they will be competing against three local councillors from Kent , one from each of the main political parties — everyone crosses their fingers that they will not be able to agree on an answer .",O O O O O O O O O O O O O O O O O O O O O O O O O B-IDIOM I-IDIOM I-IDIOM O O O O O O O O O O O O
cry wolf,"to make false alarms or warnings, leading people to not take you seriously when you are telling the truth.","Parents have been selected to become erm , relatively insensitive to signs of distress in the offspring , because erm , as where they cry wolf all the time , and as a result , erm , parents do not take crying as seriously in children as they do in adults .",O O O O O O O O O O O O O O O O O O O O O O O O B-IDIOM I-IDIOM O O O O O O O O O O O O O O O O O O O O O O O O O O
