idiom,meaning,example,tag
[pron] bottom line is,the most important point or conclusion.,"It 's something to do with relating to it , but it 's something to do with the , the final , the bottom line is that people watch .",O O O O O O O O O O O O O O O O O O O O O O B-IDIOM I-IDIOM I-IDIOM I-IDIOM O O O O
[pron] life-saver,someone who helps out in a difficult situation and is greatly appreciated.,"The well , once a life-saver for the villagers of Stoke Row , is now an intriguing curiosity for visitors who must be surprised by this touch of India in an English landscape .",O O O O B-IDIOM I-IDIOM O O O O O O O O O O O O O O O O O O O O O O O O O O O O
[pron] man of action,someone who is quick to take action and get things done.,"Almost 30 when he was finally crowned at Scone , and with his naturally introspective , melancholy temperament soured by long , enforced idleness , he drove himself to become a man of action and set about destroying those who had grown rich and powerful in his absence , especially the Albany faction .",O O O O O O O O O O O O O O O O O O O O O O O O O O O O O O B-IDIOM I-IDIOM I-IDIOM I-IDIOM O O O O O O O O O O O O O O O O O O O O
[pron] man of few words,someone who speaks very little and is not very talkative.,"Whether or not this is so , few would deny that Abbado is a sound choice , a man of few words who nevertheless commands great respect among orchestral players and is as highly praised for his Rossini as for his Mahler , his Mozart or his Brian Ferneyhough .",O O O O O O O O O O O O O O O O O B-IDIOM I-IDIOM I-IDIOM I-IDIOM I-IDIOM O O O O O O O O O O O O O O O O O O O O O O O O O O O O
[pron] place in [pron] sun,give someone recognition or praise for their accomplishments.,"Imperial expansion was driven forward not only by the collapse of order in extra-European societies , but also by intensifying competition from Britain 's European rivals for ‘ a place in the sun ’ .",O O O O O O O O O O O O O O O O O O O O O O O O O O O O B-IDIOM I-IDIOM I-IDIOM I-IDIOM I-IDIOM O O
[pron] word is law,what someone says is taken as absolute truth and must be followed.,"He was a strict disciplinarian whose word was law and , while players could argue with his views and put their own ideas to him freely , he would tolerate no arguing with umpires ; when Sobers once disputed an lbw decision he was reprimanded in front of the team .",O O O O O B-IDIOM I-IDIOM I-IDIOM I-IDIOM O O O O O O O O O O O O O O O O O O O O O O O O O O O O O O O O O O O O O O O O O O
a blessing in disguise,a good thing that initially seemed bad.,"One might argue , indeed , that his departure from power was a blessing in disguise for him , because it left others with the disagreeable but unavoidable job of extricating France from this cul-de-sac , by recognizing a powerful West German state and ultimately accepting German rearmament , by fighting and then retreating from a bloody colonial conflict in Indochina .",O O O O O O O O O O O O B-IDIOM I-IDIOM I-IDIOM I-IDIOM O O O O O O O O O O O O O O O O O O O O O O O O O O O O O O O O O O O O O O O O O O O O O O
a breath of fresh air,something new and refreshing.,"He would of course require a pastoral call even if he did not — and his car did not bode well — look like the kind of man Peter might hope for , as a breath of fresh air on the PCC ; as a possible churchwarden in place of old Sir Francis Mayhew who said he 'd done fifteen years which was more than enough ; or even as a parishioner willing to raise the £25,000 that the diocesan architect had said would have to be spent on Loxford church roof within the next three years .",O O O O O O O O O O O O O O O O O O O O O O O O O O O O O O O O O O B-IDIOM I-IDIOM I-IDIOM I-IDIOM I-IDIOM O O O O O O O O O O O O O O O O O O O O O O O O O O O O O O O O O O O O O O O O O O O O O O O O O O O O O O O O O O O
a clean bill of health,a report or statement that indicates that someone or something is in good health or has been approved.,"At Comdex Spring in Chicago last week Microsoft Corp gave a clean bill of health to the Hardware Abstraction Layer , HAL , which resides in the MIPS ' ARC specification , and is designed to facilitate this differentiation , saying that running NT on the R4000 , HAL does indeed meet its claimed potential .",O O O O O O O O O O B-IDIOM I-IDIOM I-IDIOM I-IDIOM I-IDIOM O O O O O O O O O O O O O O O O O O O O O O O O O O O O O O O O O O O O O O O O O
a fate worse than death,a situation or experience that is so unpleasant or unbearable that death would be preferable.,"Would not speak to me for six months , but then his natural goodness of heart , as well perhaps as his gradual realization that I might have been right , that perhaps I had saved him from a fate worse than death , made it impossible for him to keep it up .",O O O O O O O O O O O O O O O O O O O O O O O O O O O O O O O O O O O O O O B-IDIOM I-IDIOM I-IDIOM I-IDIOM I-IDIOM O O O O O O O O O O O
a fish out of water,someone who is in an unfamiliar situation and feels uncomfortable or out of place.,He waited to be instructed what else a Rifleman could do to be less like a fish out of water in a battalion of Grenadiers .,O O O O O O O O O O O O O O O B-IDIOM I-IDIOM I-IDIOM I-IDIOM I-IDIOM O O O O O O
a flash in the pan,something that is initially successful but quickly fades away.,"In earlier years , is it true that you attended a Senior Management Seminar as a representative of the International Sports Company , ( Dunlop , Slazenger , Carlton , Litesome ) , and stated that you had the two finest wooden rackets in the world and that you had no intention of following the fibreglass and graphite racket trend as it was all a flash in the pan ?",O O O O O O O O O O O O O O O O O O O O O O O O O O O O O O O O O O O O O O O O O O O O O O O O O O O O O O O O O O O O O O O O B-IDIOM I-IDIOM I-IDIOM I-IDIOM I-IDIOM O
a fly on the wall,an observer who is present but not noticed or involved in the situation.,But I would dearly love to be a fly on the wall during his meeting with ‘ The Godfathers ’ to hear what answers they can dredge from their souls when faced with the ruthless and uncompromising compassion of that awesome man .,O O O O O O O B-IDIOM I-IDIOM I-IDIOM I-IDIOM I-IDIOM O O O O O O O O O O O O O O O O O O O O O O O O O O O O O O O
a foot in the door,a way to get a start in a particular field or to gain access to a particular opportunity.,"The third part is perhaps something that erm , we find a little more difficult , I do found that er number two , number three and number four if you were not careful blends very much into one another and actually then part three as far as I 'm concerned actually putting across the benefits is really the main part I think and that really is putting into everyday English what we know as professionals as in technical terms , cos if you go and talk to somebody whatever it is , they have not got a clue we have , we talk about it all the time and I think the biggest criticism of the insurance industry as a whole is the fact that you do not talk to people in English and that 's why it 's got such a foot in the door and I think the third part for me really is the most important part of the sales process , relating our cock-ups in English , the benefits the client .",O O O O O O O O O O O O O O O O O O O O O O O O O O O O O O O O O O O O O O O O O O O O O O O O O O O O O O O O O O O O O O O O O O O O O O O O O O O O O O O O O O O O O O O O O O O O O O O O O O O O O O O O O O O O O O O O O O O O O O O O O O O O O O O O O O O O O O O O O O O O O O B-IDIOM I-IDIOM I-IDIOM I-IDIOM I-IDIOM O O O O O O O O O O O O O O O O O O O O O O O O O O O O O O
a load of cobblers,something that is not true or is nonsense.,"that is something that 'd happened all of a sudden , of about four throughout the cou , well three at the time throughout the country have suddenly gone like it within about a month or so of each other , and they have never had any trouble before , but I was talking to Brian and he said that 's a load of cobblers , he says it 's been doing it for a long time and there 's loads of them doing it .",O O O O O O O O O O O O O O O O O O O O O O O O O O O O O O O O O O O O O O O O O O O O O O O O O O O O O O O O O O O O O B-IDIOM I-IDIOM I-IDIOM I-IDIOM O O O O O O O O O O O O O O O O O O O O O
a new lease of life,a new opportunity to start fresh and make changes in one's life.,"Moreover , there remains the failure to refer to the lukewarm approach of the House of Lords to the Barras principle , the presumption that when Parliament continues to use a word which has been interpreted by the courts it intends the word to continue to have the judicial meaning , but the author can no doubt contend that the doctrine has been given a new lease of life by the Court of Appeal in EWP Ltd v. Moore , and A-G v. Brotherton .",O O O O O O O O O O O O O O O O O O O O O O O O O O O O O O O O O O O O O O O O O O O O O O O O O O O O O O O O O O O O O O O O B-IDIOM I-IDIOM I-IDIOM I-IDIOM I-IDIOM O O O O O O O O O O O O O O O O
a red flag,a warning sign or indication of potential danger or trouble.,"Should the person in charge of the chart see any item that was likely to fall behind , he pinned a flag at this particular point , and if the article was likely to be held up for want of raw material a blue flag was pinned up ; but if this delay was due to one or other of the works departments getting behind with the manufacture , a red flag with a numeral upon it was used , which indicated the shop or department .",O O O O O O O O O O O O O O O O O O O O O O O O O O O O O O O O O O O O O O O O O O O O O O O O O O O O O O O O O O O O O O O O O O O O O B-IDIOM I-IDIOM I-IDIOM O O O O O O O O O O O O O O O
a safe pair of hands,someone who is reliable and trustworthy and can be relied upon to do a good job.,The country as well as Mr Major are very fortunate to have such a safe pair of hands at the Foreign Office at a time when the vital question of Britain 's future within the European Union is still being determined .,O O O O O O O O O O O O O B-IDIOM I-IDIOM I-IDIOM I-IDIOM I-IDIOM O O O O O O O O O O O O O O O O O O O O O O O O
a sea change,a complete transformation or alteration.,"George Foreman , whose comeback as the roly-poly , cheeseburger contender has helped to hasten heavyweight boxing 's descent towards something dangerously close to the wide world of wrestling , recognised Lewis 's devastating performance as a sea change in the game .",O O O O O O O O O O O O O O O O O O O O O O O O O O O O O O O O O O O O B-IDIOM I-IDIOM I-IDIOM O O O O
a shot in the arm,"a sudden boost of energy, enthusiasm, or confidence.","Above all , the elections have provided a shot in the arm for the Christian right , proving , first , that blacks and Hispanics are more likely to listen to Baptist ministers and Pentecostalist preachers than the likes of Mayor Dinkins and Joseph Fernandez , and , second , that when it comes to gay sex , fundamentalists and Catholics are more than willing to co-operate with each other .",O O O O O O O B-IDIOM I-IDIOM I-IDIOM I-IDIOM I-IDIOM O O O O O O O O O O O O O O O O O O O O O O O O O O O O O O O O O O O O O O O O O O O O O O O O O O O O O O O O O O O
a sight for sore eyes,something that is very pleasing to see.,"Perhaps it could also be blamed on having flicked past hundreds of dull photos of them in The Scots Magazine over the years , showing old men with their shirt sleeves rolled up , pointing at some rolling , lumpy , big hills with the caption reading , ‘ The mighty Cairngorms are a sight for sore eyes in any rambler 's book ’ .",O O O O O O O O O O O O O O O O O O O O O O O O O O O O O O O O O O O O O O O O O O O O O O O O O O O O O B-IDIOM I-IDIOM I-IDIOM I-IDIOM I-IDIOM O O O O O O O
a slap on the wrist,a mild punishment or reprimand.,"The G M B also want employers who flout the law to be properly punished , not a slap on the wrist which many hand out , we want imprisonment for serious offenders , and fines which will make potential offenders think twice before cutting corners and putting our members at risk .",O O O O O O O O O O O O O O O O O B-IDIOM I-IDIOM I-IDIOM I-IDIOM I-IDIOM O O O O O O O O O O O O O O O O O O O O O O O O O O O O O O O
a sorry sight,something that is very sad or pitiful to look at.,"He exhibits a number of adjectives which differ in precisely the way required while maintaining the same or essentially the same lexical value ( we modify his examples slightly where it is possible to do so without damage to his case , so as to make the distinction sharper ) : ( 19 ) visible stars vs stars visible the only navigable rivers vs the only rivers navigable a handy tool vs are your tools handy ? guilty people vs people guilty As it happens , the examples which Bolinger uses employ words which can make the distinction a rather subtle one , with perhaps the exception of visible stars ( a group recognized astronomically ) beside stars visible ; but it is quite easy to produce further instances which seem to confirm his view : ( 20 ) a complaining visitor vs a visitor complaining the eligible bachelor vs the bachelor eligible In other cases , the divergence of lexical value between the two positions may be greater but still with the characteristic value for the former , and the occasion value for the latter : ( 21 ) the responsible man vs the man responsible a sorry sight vs the girl is sorry He notes that the acceptability of an adjective in pre-adjunct position may apparently depend on whether or not it can be regarded as indicating a relatively enduring characteristic of what is expressed by the noun , as in : ( 22 ) the faint girl vs the girl is faint an asleep man vs a man asleep This possibility of course depends not only on the adjective itself but also on the nature of the noun being qualified , so that "" when one scratches one 's head the result is not *a scratched head but when one scores a glass surface the result is a scratched surface "" .",O O O O O O O O O O O O O O O O O O O O O O O O O O O O O O O O O O O O O O O O O O O O O O O O O O O O O O O O O O O O O O O O O O O O O O O O O O O O O O O O O O O O O O O O O O O O O O O O O O O O O O O O O O O O O O O O O O O O O O O O O O O O O O O O O O O O O O O O O O O O O O O O O O O O O O O O O O O O O O O O O O O O O O O O O O O O O O O O O O O O O O O O O O O O O O O O O O O O O B-IDIOM I-IDIOM I-IDIOM O O O O O O O O O O O O O O O O O O O O O O O O O O O O O O O O O O O O O O O O O O O O O O O O O O O O O O O O O O O O O O O O O O O O O O O O O O O O O O O O O O O O O O O O O O O O O O O O O O O O O O O O O O O O O O O O O O O
a steal,a very good deal or bargain.,"Had Ross Brown been able to touch down on completion of his powerful break ( or Nick Penny been able to cleanly gather his pass ) off a Derrick Lee snipe after Scotland had levelled at 8-8 in the second half , then a steal might have materialised .",O O O O O O O O O O O O O O O O O O O O O O O O O O O O O O O O O O O O O O O O O O O B-IDIOM I-IDIOM O O O O
a storm in a teacup,a situation that is made to seem much more serious or important than it really is.,What to do — of anything — about the Italian Connection is a problem that has long perplexed the top administrators : some see it as a cancer at the heart of rugby ; others as a storm in a teacup of no consequence to what they see as larger and more insidious threat to amateurism in England and the rest of the ‘ Big Eight ’ .,O O O O O O O O O O O O O O O O O O O O O O O O O O O O O O O O O O O O B-IDIOM I-IDIOM I-IDIOM I-IDIOM I-IDIOM O O O O O O O O O O O O O O O O O O O O O O O O O O O
a whole new ball game,a completely different situation or set of circumstances.,"Like the legendary Atlantis , the street pattern of the 1840s has become completely submerged by a whole new ball game , several primary schools , and a generous sprinkling of inner-city whin and bashed saplings .",O O O O O O O O O O O O O O O O B-IDIOM I-IDIOM I-IDIOM I-IDIOM I-IDIOM O O O O O O O O O O O O O O O O
about face,a sudden and complete change of opinion or direction.,The only other thing that may be an answer to the question is erm I I know it seems an about face but are we going to say that er the other two sergeants that are now managers become A L O's and use them in that capacity and train 'em up .,O O O O O O O O O O O O O O O O O O O O B-IDIOM I-IDIOM O O O O O O O O O O O O O O O O O O O O O O O O O O O O O O O
above suspicion,beyond reproach; having no suspicion of wrongdoing.,"Moreover , Cynewulf , king of the West Saxons , is not found ( apart from the unacceptable evidence of CS 208 : S 108 ) in Offa 's entourage , nor does Offa 's confirmation of Cynewulf 's grant of land at North Stoke , north of Bath ( itself not above suspicion ) , to the monastery of Bath in the territory of the Hwicce ( CS 327 : S 265 ) necessarily imply a position of dependence on Offa .",O O O O O O O O O O O O O O O O O O O O O O O O O O O O O O O O O O O O O O O O O O O O O O O O O O O O B-IDIOM I-IDIOM O O O O O O O O O O O O O O O O O O O O O O O O O O O O O
above the law,not subject to the same rules and regulations as everyone else.,"Dicey himself argued that it comprised "" at least three distinct though kindred conceptions "" : "" That no man is punishable or can be lawfully made to suffer in body or goods except for a distinct breach of law established in the ordinary legal manner before the ordinary courts of the land "" ; that "" no man is above the law [ and ] every man , whatever be his rank or condition , is subject to the ordinary law of the realm and amenable to the jurisdiction of the ordinary tribunals "" ; and that "" the general principles of the constitution [ are ] the result of judicial decisions determining the rights of private persons in particular cases brought before the courts . """,O O O O O O O O O O O O O O O O O O O O O O O O O O O O O O O O O O O O O O O O O O O O O O O O O O O O O O O O O O O O B-IDIOM I-IDIOM I-IDIOM O O O O O O O O O O O O O O O O O O O O O O O O O O O O O O O O O O O O O O O O O O O O O O O O O O O O O O O O O O O O O O O O O
absence makes the heart grow fonder,being away from someone or something can make one appreciate them more.,"If that power was sufficient , the holy spirit , if that power was sufficient to raise Christ from the dead , you not think he 's able to exert that power in your life and in my life to make us live lives that are pleasing to God , of course it is so we do not do it ourselves , just let me in closing mention one other thing , this relationship we have needs to be maintained , you know for any relationship to grow , one needs to spend time with the other person , I do not give a lot of credence to the saying that absence makes the heart grow fonder , it does with somebody else , it 's true , it does not make it grow fonder of that person the person is you know who you , you heard this story so often , like particularly like going back during the last war , folk who were separated sometimes for , for , not just for months but for several years , there they were in concentration camps perhaps , in prisoner of war camps , separated for years , they come back home they have got to get to know each other all over again you see that a relationship on a human level as well as in our relationship with God is dependent on , on association , it 's dependent on companionship , it 's dependent on spending time with the other person and in our relationship with Christ this is achieved by , by prayer , by knowing and understanding God 's word , by having fellowship with other Christians and fellowship with other Christians is not just meeting them and passing the time of day with them , oh that 's fellowship but it 's far more than that is required , there 's the fellowship in worship , we worship together , of course I can worship God at home of course I can do it , so can you do it and we , we should do it , but there 's that re , there 's that need , that requirement as God 's people we come together to worship him in a corporate act , in the sacraments , in , as we mentioned in , in earlier on in taking the bread and the wine and remembering the lords death , there 's a sense in which I can do it by myself",O O O O O O O O O O O O O O O O O O O O O O O O O O O O O O O O O O O O O O O O O O O O O O O O O O O O O O O O O O O O O O O O O O O O O O O O O O O O O O O O O O O O O O O O O O O O O O O O O O O O O O O O O O O O O O O B-IDIOM I-IDIOM I-IDIOM I-IDIOM I-IDIOM I-IDIOM O O O O O O O O O O O O O O O O O O O O O O O O O O O O O O O O O O O O O O O O O O O O O O O O O O O O O O O O O O O O O O O O O O O O O O O O O O O O O O O O O O O O O O O O O O O O O O O O O O O O O O O O O O O O O O O O O O O O O O O O O O O O O O O O O O O O O O O O O O O O O O O O O O O O O O O O O O O O O O O O O O O O O O O O O O O O O O O O O O O O O O O O O O O O O O O O O O O O O O O O O O O O O O O O O O O O O O O O O O O O O O O O O O O O O O O O O O O O O O O O O O O O O O O O O O O O O O O O O O O O O O O O O O O O O O O O O O O O O O O O O O O O O O O O O O O O O O O O O O O O O O O O O
achilles heel,a person's weak spot or vulnerability.,"But none of them would be tempted to incorporate : capital is already available to them ; incorporation would not give them protection from litigation ; and , perhaps most importantly , they would lose their most precious asset — and their achilles heel — their privacy .",O O O O O O O O O O O O O O O O O O O O O O O O O O O O O O O O O O O O O O O O O O B-IDIOM I-IDIOM O O O O
aching heart,feeling of deep sadness or longing.,"The role of the lonely outsider with an aching heart but crusty exterior is this time taken by Irish actress Brenda Fricker , grimed up to her red eyeballs as a bag lady with a pigeon fetish .",O O O O O O O O B-IDIOM I-IDIOM O O O O O O O O O O O O O O O O O O O O O O O O O O O O
across the board,applying to everyone or everything in a group or category.,"Nao Naomi realizes there 's no point talking about it now , the dye has been cast the decision has been made , the commitment has been entered into , whatever the cost she was going gods way , there was nothing more to be said about it we find that a de a decision made before god and we all make those decisions , means nothing at all unless were determined to carry it through , whatever the cost may be , three women here make their decisions before god , they make their choices , Naomi she chooses to return to Judah once again and enjoy the inheritance god has given her , Auper she chooses to return to her own country and her own god , as far as were concerned that 's the end of the story , but Ruth she chooses , she expresses her faith in the one true god , she turns her back on the old ways and decides to follow gods way , no matter what the cost , she would of said with Joshua , but as for me and my husband were going to serve god , whatever the cost , I du n no what will be and she did not know what she was letting herself in for , and the , I counted it , although I do not know what it is , I counted that cost , I 'm willing to pay it and Jesus said that that is the acid test of disciples , said to count the cost and weigh it up and Ruth had done that , then to make their decision and because if we make a decision without counting the cost , without weighing it all up , like Auper you will go back , it will not last , there is that choice for every one of us day by day , who will we serve , not to be like Joshua , its for us , never for any body else , I will serve the lord because and this is the reason for it , not because you have done nice things for me , I will be your saviour because he is god , that 's the reason for our serving god , not because he blesses us because he blesses people who do not serve him , blessing is not exclusive to gods people , blessing , god blesses across the board , god is generous he 's gracious , he causes the rain and the sun to shine on the just and on the unjust , blessing is not the ground for serving god , but because he is god that 's sufficient reason for our committing ourselves to him .",O O O O O O O O O O O O O O O O O O O O O O O O O O O O O O O O O O O O O O O O O O O O O O O O O O O O O O O O O O O O O O O O O O O O O O O O O O O O O O O O O O O O O O O O O O O O O O O O O O O O O O O O O O O O O O O O O O O O O O O O O O O O O O O O O O O O O O O O O O O O O O O O O O O O O O O O O O O O O O O O O O O O O O O O O O O O O O O O O O O O O O O O O O O O O O O O O O O O O O O O O O O O O O O O O O O O O O O O O O O O O O O O O O O O O O O O O O O O O O O O O O O O O O O O O O O O O O O O O O O O O O O O O O O O O O O O O O O O O O O O O O O O O O O O O O O O O O O O O O O O O O O O O O O O O O O O O O O O O O O O O O O O O O O O O O O O O O O O O O O O O O O O O O O O O O O O O O O O O O O O O O O O O O O O O O O O O O O O O O O O O O O O O O O O O O O O O O O O O O O O O O O O O O O O O O O O O O O B-IDIOM I-IDIOM I-IDIOM O O O O O O O O O O O O O O O O O O O O O O O O O O O O O O O O O O O O O O O O O O O O O O O O O O
