idiom,meaning,example,tag
red flag,a warning sign that something is wrong or potentially dangerous.,"According to Cyril Ray in his penetrating profile Bollinger ( 1971 ) , one house was spared and he records that fifteen years after the riots Madame Bollinger overheard a passer-by outside one of her windows say , ‘ That 's the Bollinger house , you know : we did not touch it during the riots here — as a matter of fact , we lowered our flag to it when we passed ! ’ 'Probably the red flag , ’ Madame is supposed to have commented with pleased irony .",O O O O O O O O O O O O O O O O O O O O O O O O O O O O O O O O O O O O O O O O O O O O O O O O O O O O O O O O O O O O O O O O O O O O O O O O O O O O O B-IDIOM I-IDIOM O O O O O O O O O O O O
red handed,caught in the act of doing something wrong.,"The general practice is that a discount of up to one third should be allowed from a sentence but may be limited when the protection of the public is required , when there is a ‘ tactical ’ plea , or when an offender is caught red handed .",O O O O O O O O O O O O O O O O O O O O O O O O O O O O O O O O O O O O O O O O O O O O O O B-IDIOM I-IDIOM O
red ink,a financial loss or deficit.,"Amid all this turmoil and red ink , the aircraft manufacturers ( America 's Boeing and McDonnell Douglas , and the European consortium , Airbus Industrie ) together with the jet-engine makers ( America 's General Electric and Pratt & Whitney , and Britain 's Rolls-Royce ) are nervously sitting on the biggest backlog of orders in their history .",O O O O O B-IDIOM I-IDIOM O O O O O O O O O O O O O O O O O O O O O O O O O O O O O O O O O O O O O O O O O O O O O O O O O O O O O
red letter day,"a special or important day, usually one that is remembered or celebrated.","He beat Martin Molony 's record of 92 wins in 1950 , that red letter day arriving on a Sunday in November when he rode the Ulster-owned Atone to a victory at Fairyhouse .",O O O O O O O O O O O O O B-IDIOM I-IDIOM I-IDIOM O O O O O O O O O O O O O O O O O O
red tape,excessive bureaucracy and regulations that make it difficult to get something done.,"Opening the two-day conference , John Gummer renewed his attack on form filling and red tape inherent in the reformed CAP and again declared his opposition to the development of supply controls , such as compulsory land set-aside and the extension of the quota system .",O O O O O O O O O O O O O O B-IDIOM I-IDIOM O O O O O O O O O O O O O O O O O O O O O O O O O O O O O O
reinvent [pron] wheel,"to do something that has already been done before, usually in a more complicated or inefficient way.","‘ If they each do their own thing they will repeat things , but if we can bring that all together and have a centralised repository for the work that people have done , it will save having to reinvent the wheel each time .",O O O O O O O O O O O O O O O O O O O O O O O O O O O O O O O O O O O O O O O B-IDIOM I-IDIOM I-IDIOM O O O
rest up,take a break from activities to relax and recover energy.,"Admittedly Richard rode four winners too , but after poor Thetford Forest 's fatal fall had given Grand National Day a tragic finale in the Janneau Mersey Novice Hurdle , his battered rider was advised by the Jockey Club 's doctor , Rodney O'Donnell , to rest up for a week .",O O O O O O O O O O O O O O O O O O O O O O O O O O O O O O O O O O O O O O O O O O O O O O B-IDIOM I-IDIOM O O O O
ride shotgun,to sit in the front passenger seat of a car.,"It took four of them to lift him on to a trolley and take him away for observation , with the police riding shotgun at his side , and then things gradually returned to normal — or as normal as they could given the extraordinary circumstances .",O O O O O O O O O O O O O O O O O O O O O O B-IDIOM I-IDIOM O O O O O O O O O O O O O O O O O O O O O O O
right as rain,in perfect condition or health.,"At first she kept insisting she would be right as rain in the morning , but after the blackbird had heralded in three more mornings , it was clear to both mother and daughter that Martha 's grip on life was weakening .",O O O O O O O O B-IDIOM I-IDIOM I-IDIOM O O O O O O O O O O O O O O O O O O O O O O O O O O O O O O O O
ring [pron] bell,remind someone of something they should know.,"With me that rings a warning bell , since it 's one of those suspicious New Age buzzwords that always portend a scam or screwball notion such as crystal therapy or out-of-body travel .",O O O B-IDIOM I-IDIOM I-IDIOM I-IDIOM O O O O O O O O O O O O O O O O O O O O O O O O O O O
ring fencing,protecting something from external interference or risk by isolating it.,"interest tax relief , it 's M I D A S right , so let's not start talking about the benefit of public sector housing and to show the financial illiteracy of of of what 's actually been proposed if you understand the government regulation about the ring fencing o of of of the housing revenue account and and the way in which housing benefit is now having to be subsidised by those other council house tenants then what 's actually going to happen when your poor people inhabit those houses , those public sector houses and they need the housing benefit that David 's been talking about .",O O O O O O O O O O O O O O O O O O O O O O O O O O O O O O O O O O O O O O O O O O O O O O O B-IDIOM I-IDIOM O O O O O O O O O O O O O O O O O O O O O O O O O O O O O O O O O O O O O O O O O O O O O O O O O O O O O O O O O O O O
root and branch,"completely and thoroughly, leaving no part untouched.","Thank you Mr Mayor I just wanted t to come in with two fairly quick points er as to why I will not be able to support this amendment , but the first is that the leader of the council has indicated that the efficiency savings erm has got as far as it can go and that , you know , we have been trimming at the margins and there is no more margin left and that leads you to believe that perhaps one should be looking at somewhat more er root and branch type of pruning in the spending that that the labour group want to actually erm deal with , er and the second point I would like to make , and er I thank councillor for giving us a a a a new word tonight obfuscation because that describes exactly what I think the labour group are trying to do by bringing this figure down it removes the embarrassment they would have from having to add on a substantial sum of money f due to the failure to collect the cou er the community charge in previous years and I think that they are trying by by this amendment with some very quick foot work to try and delude the people of this city .",O O O O O O O O O O O O O O O O O O O O O O O O O O O O O O O O O O O O O O O O O O O O O O O O O O O O O O O O O O O O O O O O O O O O O O O O O O O O O O O O O O O O O O O O O O O B-IDIOM I-IDIOM I-IDIOM O O O O O O O O O O O O O O O O O O O O O O O O O O O O O O O O O O O O O O O O O O O O O O O O O O O O O O O O O O O O O O O O O O O O O O O O O O O O O O O O O O O O O O O O O O O O O O O O O O O O O O O O O O O O O O O O O O O O O O O O O O O O
rough time,a period of difficulty or hardship.,"A Titford family photograph taken in the early 1890s shows husband and wife with five daughters and young Marwood , the girls in neat smocks or severe black dresses , the son in an Eton collar , and every one of the group looking his or her most miserable Sunday best Those photographers who made a speciality of enticing young ladies to say ‘ prunes ’ and ‘ prisms ’ to bring out their charming dimples , called ‘ watch the birdie ! ’ with much gusto or tried ‘ cheese ! ’ in the hope of a smile would have had a rough time indeed with severe-looking Benjamin James and his wife and children .",O O O O O O O O O O O O O O O O O O O O O O O O O O O O O O O O O O O O O O O O O O O O O O O O O O O O O O O O O O O O O O O O O O O O O O O O O O O O O O O O O O O O O O O O O O O O O O O O O O O O O O O B-IDIOM I-IDIOM O O O O O O O O O O O
round the clock,"continuously, without interruption, 24 hours a day.","Nevertheless , developing and maintaining standards of high quality practice in mental health services , especially those providing ‘ round the clock ’ care in hospitals and residential homes , is an uphill struggle and people who depend on others to provide the basic necessities of life for most of their lives are necessarily vulnerable as they are not in a position to complain effectively , ‘ vote with their feet ’ or refuse to be consumers of a bad service .",O O O O O O O O O O O O O O O O O O O B-IDIOM I-IDIOM I-IDIOM O O O O O O O O O O O O O O O O O O O O O O O O O O O O O O O O O O O O O O O O O O O O O O O O O O O O O O O O O O O O
rule of thumb,"a general principle or guideline, rather than an exact formula.","how to distinguish a statistically significant coefficient , right , rule of thumb is that the T ratio has to be greater than two with absolute value right and the figures in square brackets next to the T ratios tell us the exact level of significance , right , er of that coefficient , right , so the incoming elasticity of demand is statistically significant from zero only at the eighty five percent level , a correspondence of fifteen percent significance that incoming the price elasticity demand , highly significant , right , significance level as given by the probabil by the probability er unit in square brackets , the timing level therefore we could be very highly confident about that coefficient okay .",O O O O O O O O O O B-IDIOM I-IDIOM I-IDIOM O O O O O O O O O O O O O O O O O O O O O O O O O O O O O O O O O O O O O O O O O O O O O O O O O O O O O O O O O O O O O O O O O O O O O O O O O O O O O O O O O O O O O O O O O O O O O O O O O O O O O O O O O O O O O O O
run for [pron] life,flee from a dangerous situation as quickly as possible.,"Every hill-walker dreams of seeing a wildlife drama unfold in front of them as they peer over a crag , hoping that the next rise will reveal an osprey fighting off a wildcat which it returned to find attacking the nest , forcing the great bird to drop its intended dinner , a pine marten , which runs for its life , stopping only to catch and eat a grounded , flapping , pipistrelle bat .",O O O O O O O O O O O O O O O O O O O O O O O O O O O O O O O O O O O O O O O O O O O O O O O O O O O O O O O O O B-IDIOM I-IDIOM I-IDIOM I-IDIOM O O O O O O O O O O O O O O O
run like [pron] wind,move very quickly.,"She ran like the wind back to the apartment and tumbled her few clothes into bags , then raced back through the back alleys to avoid the crowds and finally met Lucenzo pacing up and down by the column .",O B-IDIOM I-IDIOM I-IDIOM I-IDIOM O O O O O O O O O O O O O O O O O O O O O O O O O O O O O O O O O O O
run out of steam,lose energy or enthusiasm for something.,"In a sign that the rebound may be running out of steam , the Fed disclosed last night that the widely watched M2 measure of money supply , a barometer of economic activity , plummeted $7.1 billion in the week ending March .",O O O O O O O O B-IDIOM I-IDIOM I-IDIOM I-IDIOM O O O O O O O O O O O O O O O O O O O O O O O O O O O O O O O
running battle,a long-term conflict or dispute that continues over a period of time.,"BRAMSHOTT and Liphook parish councillors are continuing their fight in the long running battle to get something done about the notorious RUPP 45 , known also as The Hollow .",O O O O O O O O O O O O B-IDIOM I-IDIOM O O O O O O O O O O O O O O O O
sacred cow,"an idea, institution, or person that is treated with too much respect and not allowed to be criticized or changed.","The three most probable sources of delay will by now have passed : obtaining a local land charges certificate of search ( unless with your client 's approval you have sacrificed this sacred cow for a personal search ) ; the buyer obtaining a mortgage advance ; and the survey report , which both the buyer and the buyer 's mortgagee will have required .",O O O O O O O O O O O O O O O O O O O O O O O O O O O O O O O O B-IDIOM I-IDIOM O O O O O O O O O O O O O O O O O O O O O O O O O O O O O O O
safe and sound,unharmed and in good condition.,"Now , as socialism knocks on the door of Number 10 , the Hoorays are preparing to go back underground , adopting once again the protective colouring that has kept the British upper classes safe and sound while heads have rolled all over Europe .",O O O O O O O O O O O O O O O O O O O O O O O O O O O O O O O O O O B-IDIOM I-IDIOM I-IDIOM O O O O O O O O
safety in numbers,being in a group makes one feel more secure and protected.,"Well I think much as I welcome the university proceeding down the road that it is , erm I have a very , very strong feeling that change is going to come from the bottom up , and I think that it will come from the bottom up in those colleges , like New College , who have got an increasingly large number of women fellows who feel that , you know , there 's safety in numbers and we can start to do something about it .",O O O O O O O O O O O O O O O O O O O O O O O O O O O O O O O O O O O O O O O O O O O O O O O O O O O O O O O O O O O O O O O O O O O O O O O O O O O B-IDIOM I-IDIOM I-IDIOM O O O O O O O O O O
sail close to [pron] wind,"take risks, act dangerously, or do something that is close to the edge of what is acceptable.","Osnafeld is a British subject , a financier of sorts who has sailed very close to the wind on a number of occasions , but there has never been enough evidence to proceed against him .",O O O O O O O O O O O O B-IDIOM I-IDIOM I-IDIOM I-IDIOM I-IDIOM I-IDIOM O O O O O O O O O O O O O O O O O O
salad days,"a period of youthful innocence, inexperience, and enthusiasm.","Robert Rauschenberg ( whose newest work , ‘ Bicycloids ’ , ‘ Urban Bourbons ’ and ‘ Eco-Echo ’ is at Knoedler from 8 May to 4 June ) would , in his salad days , make ‘ combines ’ out of whatever junk came to hand during an evening 's walk in the streets .",O O O O O O O O O O O O O O O O O O O O O O O O O O O O O O O O O B-IDIOM I-IDIOM O O O O O O O O O O O O O O O O O O O O O
salt of the earth,"a person who is honest, hardworking, and reliable.","so she said I , I went in and I said to Geraldine I 'm going I owe you any bloody money take the bugger out me wages , she says I am not having people that I like being stabbed like that by people like that , she said she is not worth the salt of the earth , she 's the salt of the earth she said with people like that pointing to Jenny and Jane , no way , she said and I 'm going with my mates , I turned round and the next thing Janet and Janet and Barbara in there , when we got up the pub at twelve o'clock , course we were all having sandwiches me and Pam got the , me and er Barb got there , then Pam come in then a few more come and erm then the plumber and all that come in with them and I said oh girls we never clocked out , so I said oh well I 'm going to have to take my key back to Steve , burst out laughing , so I said oh no I said why do not we have a key cracking competition so of course that 's what we did we all took our keys out of our bag and we went ready for she 's a jolly good ready , steady , fellow , for she 's go and we cracked these ruddy keys and shoved them up in the air",O O O O O O O O O O O O O O O O O O O O O O O O O O O O O O O O O O O O O O O O O O O O O O O O O O O O O O O O O O O O O O O B-IDIOM I-IDIOM I-IDIOM I-IDIOM O O O O O O O O O O O O O O O O O O O O O O O O O O O O O O O O O O O O O O O O O O O O O O O O O O O O O O O O O O O O O O O O O O O O O O O O O O O O O O O O O O O O O O O O O O O O O O O O O O O O O O O O O O O O O O O O O O O O O O O O O O O O O O O O O O O O O O O O O O O O O O O O O O O O O O O O O O O O O O O O O O O O O O O O O O O O O O O O O O O O O O O O O O O O
save face,to maintain one's dignity or reputation in a difficult or embarrassing situation.,"Finally , our heartfelt thanks to the Haç and Manchester 's equally fine Most Excellent posse , whose joint party for the SAVE FACE fund last month raised a stunning £2,500 — more details of this and other Ligger 's Week events on page 8",O O O O O O O O O O O O O O O O O O O O O O B-IDIOM I-IDIOM O O O O O O O O O O O O O O O O O O O O O
say [pron] piece,express one's opinion or feelings on a particular subject.,"Erm certainly I think all of our quarry , the quarry , I think we were overwhelmed with the support because it was really in our place that the dispute started and a lot of other people who I 'd spoken to you know they they were amazed at the support we received and , seemed to be the shyer the people you know the , some of the lads they never spoke much at lodge meetings , but after a while they 'd be getting up and saying their pieces and , you know I think it 's just because you knew you had backing , and people helping and urging you on , advising you , and the union helping and you know they leant over backwards in various fields to help us .",O O O O O O O O O O O O O O O O O O O O O O O O O O O O O O O O O O O O O O O O O O O O O O O O O O O O O O O O O O O O O O O O O O O O O O O O O O O O O O O O O O O O O O O O B-IDIOM I-IDIOM I-IDIOM O O O O O O O O O O O O O O O O O O O O O O O O O O O O O O O O O O O O O O O O O O O O O
scarlet woman,a woman who is considered to be immoral or promiscuous.,What I really wrote to tell you is that the Ballet Club Committee says that the Scarlet Woman must be changed — so please do two new designs for me to choose from — and help me !,O O O O O O O O O O O O O O O O B-IDIOM I-IDIOM O O O O O O O O O O O O O O O O O O O O
scrape together,gather or accumulate something with difficulty or by using all available resources.,"We prop the grating open with another branch and spend the next half-hour pulling fallen branches and logs from all over that part of the hill , dragging them into the clump of bushes and throwing them into the shaft ; we snap dead branches off trees and bushes and haul and peel living ones off ; we scrape together armfuls of dry leaf litter and throw those over the edge of the chimney , too ; everything goes under the grating and down into the shaft .",O O O O O O O O O O O O O O O O O O O O O O O O O O O O O O O O O O O O O O O O O O O O O O O O O O O O O O O O O O B-IDIOM I-IDIOM O O O O O O O O O O O O O O O O O O O O O O O O O O O O
scratch [pron] head,puzzled or confused about something.,When another few minutes went by she was scratching her head to try and think up some way of making sure that Naylor would consider any such notion laughable .,O O O O O O O O B-IDIOM I-IDIOM I-IDIOM O O O O O O O O O O O O O O O O O O O
scream blue murder,shout or yell very loudly and angrily.,"TACKLING your opponent very hard and then lifting him up with your hands under his armpits and pulling his hairs until he is screaming blue murder — and you say to the referee ‘ Well , I 'm only trying to help him ! ’",O O O O O O O O O O O O O O O O O O O O O O O B-IDIOM I-IDIOM I-IDIOM O O O O O O O O O O O O O O O O O O O
see [pron] point,understand and agree with someone's opinion.,Will he bring home to Ministers on the continent the fact that the headage basis would prove devastating for hill and upland farmers in the United Kingdom and will he do everything possible to make those Ministers see our point of view ?,O O O O O O O O O O O O O O O O O O O O O O O O O O O O O O O O O O O O O B-IDIOM I-IDIOM I-IDIOM O O O
see eye to eye,"agree on something, have the same opinion.","He said he could not serve on that sub-committeee ( consisting of Brian Close , Bob Appleyard , Phil Sharpe , Bryan Stott , Tony Woodhouse ) ‘ when I do not see eye to eye with them on any subject ’ .",O O O O O O O O O O O O O O O O O O O O O O O O O O O O O O O O B-IDIOM I-IDIOM I-IDIOM I-IDIOM O O O O O O O
self explanatory,clear and understandable without needing further explanation.,"Good morning David , I 'm enclosing three pages of a fax which I have just received from Teagasc capital T E A G A S C which is self explanatory stop , I hope you can make it all out , comma , if not please come back to me , full stop , paragraph , it would be a help if you could get your shipping agents to provide us with the rates they would have charged paragraph , many thanks and best regards , Sam .",O O O O O O O O O O O O O O O O O O O O O O O O O O O O O B-IDIOM I-IDIOM O O O O O O O O O O O O O O O O O O O O O O O O O O O O O O O O O O O O O O O O O O O O O O O O O O O O O O O O O O
self-made man,a person who has achieved success and wealth through their own hard work and determination.,"When they first met for real the fierce , cold , autocratic , heroically self-made man 's beady eye and cockily addressed him as ‘ Washy ’ to his face , well , petrification set in , sometimes terminal .",O O O O O O O O O O O O O O B-IDIOM I-IDIOM O O O O O O O O O O O O O O O O O O O O O O O O
sell [pron] soul to [pron] devil,make a deal with someone that involves sacrificing one's principles or values in exchange for something desired.,"Directed by Tony Hegarty For one night only , prior to opening in London , Commonwheal ‘ Exciting and revelatory … a true ensemble ’ Daily Mail , bring their new version of Marlowe 's classic tale of a man who sells his soul to the devil for knowledge and power .",O O O O O O O O O O O O O O O O O O O O O O O O O O O O O O O O O O O O O O O O O B-IDIOM I-IDIOM I-IDIOM I-IDIOM I-IDIOM I-IDIOM O O O O O
set [pron] ball rolling,start a process or activity.,"And there was double delight for the Irish contingent as Ronnie Smyth 's under-16 squad had earlier set the ball rolling by overturning a 2–0 deficit to beat the Welsh 3–2 , thanks to a Colin Hanna hat-trick of short corner conversions in the last 15 minutes .",O O O O O O O O O O O O O O O O O B-IDIOM I-IDIOM I-IDIOM I-IDIOM O O O O O O O O O O O O O O O O O O O O O O O O O O O
shake in [pron] shoes,be very scared or nervous about something.,"And Hodkinson added : ‘ After beating a fighter as good as Mexico 's Marcos Villasana to win the title , I 'm not exactly shaking in my shoes about facing Benichou . ’",O O O O O O O O O O O O O O O O O O O O O O O O O B-IDIOM I-IDIOM I-IDIOM I-IDIOM O O O O O
shelf life,the amount of time something is useful or relevant before it becomes outdated.,"There was A12 , Waste Management Group , where the plutonium and highly enriched uranium and beryllium and tritium were taken from weapons that had achieved their shelf life in the guts of submarines and the bunkers of Air Force camps , then reworked for newer and more potent devices .",O O O O O O O O O O O O O O O O O O O O O O O O O O O B-IDIOM I-IDIOM O O O O O O O O O O O O O O O O O O O O O O
shift gears,"change direction, approach, or focus.","Having effectively established the background of decadence , savagery and corruption that was Rome in 300 AD , the play shifts gears after the interval for the arrival of a travelling theatre company which is to present an entertainment for the newly installed Emperor .",O O O O O O O O O O O O O O O O O O O O B-IDIOM I-IDIOM O O O O O O O O O O O O O O O O O O O O O O O
shiver down [pron] spine,experience a feeling of fear or dread.,"Always the song of the nightingale sends shivers down my spine — because of its amazing variety , its richness and power and sheer quality .",O O O O O O O B-IDIOM I-IDIOM I-IDIOM I-IDIOM O O O O O O O O O O O O O O O
shoot straight,be honest and direct in one's communication.,"The flames shot straight up into the sky , dispersing whatever fog was in the immediate area , and we sat around on bales , as we have always done , while some members of the family let off fireworks in the background .",O O B-IDIOM I-IDIOM O O O O O O O O O O O O O O O O O O O O O O O O O O O O O O O O O O O O O O O O
shoot through,leave quickly or abruptly.,"At all events , it enables her to explore the danger that shoots through many childhoods : the fear of losing mother or father , the conflict we often endure as we hear their exasperated voices arguing above our heads or while we are in bed .",O O O O O O O O O O O O B-IDIOM I-IDIOM O O O O O O O O O O O O O O O O O O O O O O O O O O O O O O O O O
silver bullet,a simple solution to a complex problem.,"The garlic , wooden stake and silver bullet ( to continue this fantastic metaphor ) are provided by the application of a more modern approach to science than that offered by eighteenth- and nineteenth-century paradigms .",O O O O O O B-IDIOM I-IDIOM O O O O O O O O O O O O O O O O O O O O O O O O O O O O
silver fox,an attractive older man.,"Domestication or controlled breeding of hitherto wild animals for their products has been commercially successful : witness such ventures as fur ranches for silver fox , mink , and chinchilla An unusual and profitable business in Thailand is exporting 2000 skins annually of a hybrid crocodile ( Crocoytus porosus X C. palustris ) .",O O O O O O O O O O O O O O O O O O O O O O O B-IDIOM I-IDIOM O O O O O O O O O O O O O O O O O O O O O O O O O O O O O
silver lining,a hopeful or comforting aspect of a situation that is otherwise difficult or unpleasant.,"There was so much of loveliness in every scene , my mind was surfeited with joys : how the far-spreading bay , with its expanse of white shell-sand , was girded by a sea which placidly reflected the blue of heaven ; and how the seaweeds left their markings in curious lines just where the last outgoing wavelet left them ; the grassy knolls girding the hollow of the bay , and the rock promontories , whose darker tones gave force to the silver lining of the breaking wavelet .",O O O O O O O O O O O O O O O O O O O O O O O O O O O O O O O O O O O O O O O O O O O O O O O O O O O O O O O O O O O O O O O O O O O O O O O O O O O O O O O O O O O B-IDIOM I-IDIOM O O O O O
