idiom,meaning,example,tag
ill-gotten gains,money or other benefits that were obtained illegally or unethically.,"Swegen also had dealings with the Swedes , and involved himself with Normandy and in the Irish Sea , perhaps selling his ill-gotten gains and fraternising not only with Duke Richard II in Rouen , but also the rulers of Norse settlements in Ireland such as Dublin , Wexford , Waterford , Cork and Limerick .",O O O O O O O O O O O O O O O O O O O O O O B-IDIOM I-IDIOM O O O O O O O O O O O O O O O O O O O O O O O O O O O O O O O O
in a fog,confused and unable to think clearly.,"The phenomenon of light scattering by small particles is familiar to us all ; the blue colour of the sky or the varied colours of a sunset , the poor penetration of car headlights in a fog is caused by water droplets scattering the light , and the obvious presence of dust in a sunbeam or the Tyndall effect in an irradiated colloidal solution are further examples of this effect .",O O O O O O O O O O O O O O O O O O O O O O O O O O O O O O O O O O B-IDIOM I-IDIOM I-IDIOM O O O O O O O O O O O O O O O O O O O O O O O O O O O O O O O O O O
in a nutshell,in a few words; concisely.,I mean suddenly we had the example of a women 's support group from the miner 's strike th that we had the idea you know fr from that erm and Yona really put it in a nutshell when she said I think er er you know behind closed doors the women worrying about what was going to happen next you know they felt very frustrated and in a way it was a way to channel o our energies away i i i it was seen as that really in the beginning you know as a a sort of a more as a way of getting rid of the well y you know the sort of desperation er the impotence one felt of not being able to do anything in this situation and it 's er and by now of course we have all become as a group very close er you know we 're we 're more like a big family now really an sort of er a lot of the women have never really sort of regularly been to meetings an th the commitment there is very strong really that we all turn up to our Tuesday meetings sort of .,O O O O O O O O O O O O O O O O O O O O O O O O O O O O O O O O O O O B-IDIOM I-IDIOM I-IDIOM O O O O O O O O O O O O O O O O O O O O O O O O O O O O O O O O O O O O O O O O O O O O O O O O O O O O O O O O O O O O O O O O O O O O O O O O O O O O O O O O O O O O O O O O O O O O O O O O O O O O O O O O O O O O O O O O O O O O O O O O O O O O O O O O O O O O O O O O O O O O O O O O O O O O O O O O O O O O O O O O O O O O O
in a trice,very quickly.,"Indeed , let that be your percept : the hot blood gushes forth , yet instantly the Marine is firm as stone in his intellectus — aye , and spry as quicksilver which can flood through a maze of branching routes in a trice , illuminating all possibilities ! ’",O O O O O O O O O O O O O O O O O O O O O O O O O O O O O O O O O O O O O O O O O B-IDIOM I-IDIOM I-IDIOM O O O O O O
in bad shape,in a difficult or unfavorable situation.,"My lack of means is extreme , granted , and I look bad , skin white , mouth chapped , body apparently even shorter than usual , eye roaming and I daresay a bit fretful , trousers in bad shape , attention astray for a book lying around to pinch or even an old magazine , since I sold a few volumes I should now like to have kept , in exchange for a slug of what turned out to be the world 's nastiest though cheapest whiskey .",O O O O O O O O O O O O O O O O O O O O O O O O O O O O O O O O O O O O O B-IDIOM I-IDIOM I-IDIOM O O O O O O O O O O O O O O O O O O O O O O O O O O O O O O O O O O O O O O O O O O O O O O O O O
in cahoots with,working together in secret to achieve a goal.,"A collaboration from the depths of hell looks on the cards , we can report with our fingers stuffed prematurely in our ears , as VIC REEVES and BOB MORTIMER have been spotted in cahoots with THE BEAUTIFUL SOUTH all over London recently .",O O O O O O O O O O O O O O O O O O O O O O O O O O O O O O O O O B-IDIOM I-IDIOM I-IDIOM O O O O O O O O
in cold blood,"in a deliberate and calculated manner, without emotion.","Few as they were , they might be sufficient , for the men in them would be seasoned seamen and raiders who would brawl for the love of it , on shipboard anywhere ; who would defend their own northern lands to the death , on land or on sea ; but who would never march south in cold blood to throw away life defending a foreigner 's ground .",O O O O O O O O O O O O O O O O O O O O O O O O O O O O O O O O O O O O O O O O O O O O O O O O O O O O O O O O O B-IDIOM I-IDIOM I-IDIOM O O O O O O O O O O
in limbo,in a state of uncertainty or delay with no resolution in sight.,"There is a partial line on the map which I think this Council agreed before my time but that is not a line which could be implemented because it starts from nowhere and goes to nowhere and we are still I believe in , in , in limbo so far as the exact route which might be proposed either the northern or the southern end .",O O O O O O O O O O O O O O O O O O O O O O O O O O O O O O O O O O O O O O O O O O O O O O B-IDIOM I-IDIOM O O O O O O O O O O O O O O O O O O
in name only,having a title or position but no real authority or power.,"This too was the strongest argument offered in favour of one Sandy Forbes , who hoped for the office of surgeon 's mate of the Sutherland Fencibles in 1779 , though in his case he clearly intended to be an officer in name only for he intended to apply for leave to complete his degree at Edinburgh University and to sail for India as an officer of an East Indiaman at the first suitable opportunity .",O O O O O O O O O O O O O O O O O O O O O O O O O O O O O O O O O O O O O O O O O B-IDIOM I-IDIOM I-IDIOM O O O O O O O O O O O O O O O O O O O O O O O O O O O O O O O O
in the bag,a situation that is certain to be successful.,"We have the club slides in our house so that you know really whoever takes over organizing the meeting should really have those and they 're all sorted out in order so it 's just a case of diving in the bag and looking for whatever you want , ever the I always try to bring some fish to look at , to the the scr to the screen erm some of the fish that were on show on the table for that particular sh er in erm table show because I think it shows interest and to learn more about the fish and it 's always nice when somebody else knows a lot more about the particular species than you do , and i is able to tell you quirks and fancies that they have .",O O O O O O O O O O O O O O O O O O O O O O O O O O O O O O O O O O O O O O O B-IDIOM I-IDIOM I-IDIOM O O O O O O O O O O O O O O O O O O O O O O O O O O O O O O O O O O O O O O O O O O O O O O O O O O O O O O O O O O O O O O O O O O O O O O O O O O O O O O O O O O O O O O O O O O O O O O O
in the best of health,in excellent physical and mental health.,"Having seen him safely in hospital , though not in the best of health myself , I called at the poll tax office and waited one and a half hours in a very smoky atmosphere to have the summons withdrawn .",O O O O O O O O O B-IDIOM I-IDIOM I-IDIOM I-IDIOM I-IDIOM O O O O O O O O O O O O O O O O O O O O O O O O O O O
in the blink of an eye,"very quickly, almost instantaneously.","One moment Angel One had been crouched motionless as a carved statue , the next he seemed to have been transposed several feet nearer in the blink of an eye , like a faulty sequence in some badly cut movie .",O O O O O O O O O O O O O O O O O O O O O O O O B-IDIOM I-IDIOM I-IDIOM I-IDIOM I-IDIOM I-IDIOM O O O O O O O O O O O
in the cold light of day,when looking at a situation objectively and without emotion.,"understand why all the agencies involved identify four in those circumstances I think in R A Southern Water district to themselves , because we have got that information repeated across the county erm and it seemed to me important that erm somebody er accepted responsibility for taking an overall view of the circumstances to er merely because of course we can only concern ourselves with manmade er circumstances rather than er erm but I think you know members would agree that as a strategic planning authority , we appear to be the only auth er the only body which can erm in the cold light of day we view the circumstances look at the implications for strategic planning and local planning and the suggestion of those developments and obviously that would be a concern to us and er I felt and I have to that it is an area of responsibility erm which er within the of this",O O O O O O O O O O O O O O O O O O O O O O O O O O O O O O O O O O O O O O O O O O O O O O O O O O O O O O O O O O O O O O O O O O O O O O O O O O O O O O O O O O O O O O O O O O O O O O O O O O O O O B-IDIOM I-IDIOM I-IDIOM I-IDIOM I-IDIOM I-IDIOM O O O O O O O O O O O O O O O O O O O O O O O O O O O O O O O O O O O O O O O O O O O O O O O O O O O
in the dock,"in a court of law, accused of a crime and awaiting judgement.","Now the boatmen they used to erm the name , the family of a name of , and the old man , the grandfather his name was and then they had three sons who were boatmen , one was called Arthur John , one had a nickname of Snowball , the other one 's name was George and they used to er , some of them at times used to row from the lock gates out to the Cork Lightship together to get a boat , so they made sure of roping that boat in at , at er in the dock or at Cliff Quay and course they used to get the captain of the ship to sign er a bill and they used to take that to the , to the shipping agent and then he 'd pay 'em the money .",O O O O O O O O O O O O O O O O O O O O O O O O O O O O O O O O O O O O O O O O O O O O O O O O O O O O O O O O O O O O O O O O O O O O O O O O O O O O O O O O O O O O O O O O O O O O O O O O O O O B-IDIOM I-IDIOM I-IDIOM O O O O O O O O O O O O O O O O O O O O O O O O O O O O O O O O O O O O O O O O O O
in the eyes of the law,according to the legal system.,"Now in the eyes of the law , they have committed a crime , but if you put that situation before a jury , and even though the judge may instruct the jury , a crime has been committed , you must find them guilty , the jury 's inclination will probably be to say , natural justice , you , that you you done what was required of you , that you do not deserve to be either convicted or sent to prison for it .",O B-IDIOM I-IDIOM I-IDIOM I-IDIOM I-IDIOM I-IDIOM O O O O O O O O O O O O O O O O O O O O O O O O O O O O O O O O O O O O O O O O O O O O O O O O O O O O O O O O O O O O O O O O O O O O O O O O O O O O O O O O
in the family way,pregnant.,"Esther Dyson had consistently denied being pregnant , but two days prior to the discovery of the child , she had appeared very big in the family way , then the next morning , Mrs. Greaves noticed that Esther Dyson was pale , languid , weak and thinner , as if she had delivered a child .",O O O O O O O O O O O O O O O O O O O O O O O O B-IDIOM I-IDIOM I-IDIOM I-IDIOM O O O O O O O O O O O O O O O O O O O O O O O O O O O O O
in the heat of the moment,acting impulsively without considering the consequences.,"If ‘ that bloody woman ’ had heard him utter such a curse , she would have ripped into him with a piece of her mind , then he would have whipped her with his tongue , then this sop of a man before him would have got between them , and afore you knew it , there would be a full-scale war waging — and in the heat of the moment he might foolishly betray his devious plans to boot the lot of them out of his house and out of his life .",O O O O O O O O O O O O O O O O O O O O O O O O O O O O O O O O O O O O O O O O O O O O O O O O O O O O O O O O O O O O O O O O O O B-IDIOM I-IDIOM I-IDIOM I-IDIOM I-IDIOM I-IDIOM O O O O O O O O O O O O O O O O O O O O O O O
in the nick of time,just in time; at the last possible moment.,"For the world , he will play the Hermit of Croisset ; for his friends in Paris , he will play the Idiot of the Salons ; for George Sand he will play the Reverend Father Cruchard , a fashionable Jesuit who enjoys hearing the confessions of society women ; for his intimate circle he will play Saint Polycarpe , that obscure Bishop of Smyrna , martyred in the nick of time at the age of ninety-five , who pre-echoed Flaubert by stopping up his ears and crying out , ‘ Oh Lord !",O O O O O O O O O O O O O O O O O O O O O O O O O O O O O O O O O O O O O O O O O O O O O O O O O O O O O O O O O O O O O O O O O O O B-IDIOM I-IDIOM I-IDIOM I-IDIOM I-IDIOM O O O O O O O O O O O O O O O O O O O O O O
in the pink,in good health,"Considering that the Soviet economy is not in the pink of health in its own right , it only makes sense to ask whether the burden will remain affordable — and , indeed , whether hard economic facts will not drive the USSR to reassess the wisdom of maintaining anything so extravagant as a Socialist Commonwealth in her present circumstances .",O O O O O O O B-IDIOM I-IDIOM I-IDIOM O O O O O O O O O O O O O O O O O O O O O O O O O O O O O O O O O O O O O O O O O O O O O O O O O O O
in the pipeline,in the process of being developed or completed.,"It is a worrying time for the Cupertino company , but it probably can come through more or less unscathed , simply because people buy Apple kit not for the underlying technology but for what 's on top of it , so provided a happy marriage can be arranged between the PowerPC hardware and Apple 's software , and the thing ends up looking to the user like a Macintosh that is simply faster , more powerful , more easy to use and in all ways better than the 68040-based models , Apple should be able to scrape through — and there is still a Motorola Inc 68060 in the pipeline that Apple can fall back on if everything in the IBM relationship goes awry .",O O O O O O O O O O O O O O O O O O O O O O O O O O O O O O O O O O O O O O O O O O O O O O O O O O O O O O O O O O O O O O O O O O O O O O O O O O O O O O O O O O O O O O O O O O O O O O O O O O O O O O O O O O O O B-IDIOM I-IDIOM I-IDIOM O O O O O O O O O O O O O O O
in the same boat,in the same situation or predicament.,"These strategies were exemplified in statements on the part of respondents such as ‘ count your blessings ’ , or ‘ we 're all in the same boat ’ , and in methods such as perceiving hardship as the forerunner of an easier future , or devaluing the importance of aspects which are noxious ( such as an unpleasant boss and colleagues ) and magnifying good aspects ( such as the convenient location and reasonable pay of the job ) .",O O O O O O O O O O O O O O O O O O O O O O O O B-IDIOM I-IDIOM I-IDIOM I-IDIOM O O O O O O O O O O O O O O O O O O O O O O O O O O O O O O O O O O O O O O O O O O O O O O O O O O O O O
in the wake of,"as a result of, following.","Never leaving us to feel that he has short-changed us , each observation complete in itself , as if it has been roundly considered before utterance , he manages to accommodate the following items of interest in that eighteen hundred words : a comparison between Hebridean manners of burial and Roman funeral rites ; the weather ( repeatedly ) ; the literacy of the Hebrideans ; how travellers are accommodated , there being no hotel system ; diet — wild-fowl , fish , venison , beef , mutton , goat , poultry , bread ; whisky for breakfast ( the morning dram , known as a ‘ skalk ’ ) ; the availability of tea , coffee , marmalade and other preserves , honey and cheese ; trading practices — wine from the French in exchange for wool ; culinary variety , short on vegetables other than potatoes , not good on custards ; napery , crockery and cutlery ; the abating fervour of the clans in the wake of Culloden ; and he believed he saw the slow rise of prosperity under the ‘ unpleasing consequences of subjection , .",O O O O O O O O O O O O O O O O O O O O O O O O O O O O O O O O O O O O O O O O O O O O O O O O O O O O O O O O O O O O O O O O O O O O O O O O O O O O O O O O O O O O O O O O O O O O O O O O O O O O O O O O O O O O O O O O O O O O O O O O O O O O O O O O O O O O O O O O O O O O O O O O O O O O O O O O O O O O O O O O O O O O O O B-IDIOM I-IDIOM I-IDIOM I-IDIOM O O O O O O O O O O O O O O O O O O O O O
in the zone,a state of intense focus and concentration on a task.,"These included recognition and respect for the zone of peace , freedom and neutrality by all states , in particular the Great Powers ; abstention by the ASEAN states from participation in conflicts between the Great Powers ; guarantees for the zone from the Great Powers — the United States , the USSR and China ; securing the legal rights of Great Powers in the region ; and observance of the obligation of the peaceful settlement of all disputed questions between the states participating in the zone .",O O O O O O O O O O O O O O O O O O O O O O O O O O O O O O O O O O O O O O O O O O O O O O O O O O O O O O O O O O O O O O O O O O O O O O O O O O O O O O O O O O O O B-IDIOM I-IDIOM I-IDIOM O
inside job,a crime or other misdeed committed by someone within an organization or group.,"The police suspected that it was an inside job and promptly arrested the dismissed worker , for no reason other than that she might have borne a grudge against her erstwhile employer .",O O O O O O O B-IDIOM I-IDIOM O O O O O O O O O O O O O O O O O O O O O O O O
itchy feet,a strong desire to travel or explore new places.,"And I sort of started to get itchy feet to come back and do things in the early eighties and that 's when I went to Liverpool , I did a play with , I did Alfie with Alan who just directed the Commitments and er we went to a b and that really got me fired up to start again , and I sort of did some theatre stuff through the bits and pieces through the eighties until Love Hurts came .",O O O O O O O B-IDIOM I-IDIOM O O O O O O O O O O O O O O O O O O O O O O O O O O O O O O O O O O O O O O O O O O O O O O O O O O O O O O O O O O O O O O O O O O O O O O O O O O
jack of all trades,someone who is competent in many different skills or activities.,"The shift towards greater delegation , role specialization and collective decision-making in primary schools , and the emergence of what we have termed departmental , three-tier and matrix management structures , appears to be an inevitable and necessary consequence of the growing complexity of the work of primary schools and the diminishing currency of the ‘ jack of all trades ’ view of the class teacher 's and head 's roles .",O O O O O O O O O O O O O O O O O O O O O O O O O O O O O O O O O O O O O O O O O O O O O O O O O O O O O O O O B-IDIOM I-IDIOM I-IDIOM I-IDIOM O O O O O O O O O O O O
join [pron] club,become part of a group or activity that someone else is already involved in.,"You can also join the club by sending four lion marks to : The British Egg Information Service , 126–128 Cromwell Road , London SW7 4ET with your details .",O O O B-IDIOM I-IDIOM I-IDIOM O O O O O O O O O O O O O O O O O O O O O O O O
jump [pron] gun,act too quickly or prematurely.,There had been suggestions that directors had jumped the gun by putting a figure to the fraud before Coopers had completed its report .,O O O O O O O B-IDIOM I-IDIOM I-IDIOM O O O O O O O O O O O O O O
jump in at [pron] deep end,to take on a difficult task without any prior experience or preparation.,"And as Cram prepared to jump in at the deep end with a clash against Olympic 10,000m champion Khalid Skah in the BUPA International Festival of Running , race organiser Brendan Foster tipped his pal to rekindle memories of his glory days in his new event .",O O O O O B-IDIOM I-IDIOM I-IDIOM I-IDIOM I-IDIOM I-IDIOM O O O O O O O O O O O O O O O O O O O O O O O O O O O O O O O O O O O O
jump on [pron] bandwagon,"join a popular trend or opinion, usually without considering the consequences.","There have been several hospitalisations over the past few months , people who entered catatonic states after taking what they believed was E but turned out to be K. Now everybody is jumping on the Ketamine bandwagon .",O O O O O O O O O O O O O O O O O O O O O O O O O O O O O O O O B-IDIOM I-IDIOM I-IDIOM I-IDIOM I-IDIOM O
jump to conclusions,make a decision or judgment without having all the facts.,"In 1983 , observations from the IRAS infra-red satellite showed that it is associated with cool material which might be interpreted as a planetary system , though it would be most unwise to jump to any conclusions .",O O O O O O O O O O O O O O O O O O O O O O O O O O O O O O O O O B-IDIOM I-IDIOM I-IDIOM I-IDIOM O
just deserts,the reward or punishment that someone deserves.,"This was so whether the reformative sentence would be disproportionately long or disproportionately short , although most adherents of the Justice Model in the 1970s ( who tended to be liberal or moderately radical in political persua-sion ) wanted a just deserts system which would punish less harshly overall — again like Beccaria two centuries previously .",O O O O O O O O O O O O O O O O O O O O O O O O O O O O O O O O O O O O O O O O B-IDIOM I-IDIOM O O O O O O O O O O O O O O O
just in case,to be prepared for any eventuality.,"Relationship between trade and between members of state , strictly competition and I said I 'd be the one erm relative case , just to demonstrate the course , Lord , erm I have usefully used the time this morning to do a , a brief aden am moire of the point , the relevant photographs and the , just in case , if I can just hand that out ena enable me to , to speed through the admission , my Lord if I can just er take the through it and apart , my Lord paragraph five is triggered by an agreement which effects trade between members of states , er in windsurfing the court considered an argument that the causes and the contested agreement which had been struck down by the commission did not forward then article eighty five because they did not have that trade between members of states , the court replied , that argument must be rejected , article eighty five does not require that each and individual cause in the agreement should be capable of affecting into community trade , community law or competition applies to agreements between undertakings which may effect member of states , only if the agreement as a whole is capable of effecting trade is it necessary to exam which other clauses of the agreement which havers there object , let's just say or , or effect the restriction of competition .",O O O O O O O O O O O O O O O O O O O O O O O O O O O O O O O O O O O O O O O O O O O O O O O O O O O O O O O O O O O B-IDIOM I-IDIOM I-IDIOM O O O O O O O O O O O O O O O O O O O O O O O O O O O O O O O O O O O O O O O O O O O O O O O O O O O O O O O O O O O O O O O O O O O O O O O O O O O O O O O O O O O O O O O O O O O O O O O O O O O O O O O O O O O O O O O O O O O O O O O O O O O O O O O O O O O O O O O O O O O O O O O O O O O O O O O O O O O O O O O O O O O O O O O O O O O O O O O O O O O O O
just what the doctor ordered,exactly what is needed to solve a problem or make a situation better.,"Competition is so great between the two giants of the industry ( and I have not even begun to think about Unix and the Mac operating system , never mind the combined IBM/Apple OS ) that , behind the hype ( of which I predict there will be much ) there will be a rock solid operating system developed , and it will be just what the doctor ordered .",O O O O O O O O O O O O O O O O O O O O O O O O O O O O O O O O O O O O O O O O O O O O O O O O O O O O O O O O O O O O O O O O B-IDIOM I-IDIOM I-IDIOM I-IDIOM I-IDIOM O
kangaroo court,a mock court in which the proceedings are biased and unjust.,"Now what will be concerning the last hard core will be that amongst them can almost certainly the people who were involved in the original planning of the er uprising or riot , and also who probably er orchestrated the Kangaroo Courts .",O O O O O O O O O O O O O O O O O O O O O O O O O O O O O O O O O O O O O O O O B-IDIOM I-IDIOM O
keep [pron] cool,remain calm and composed in a difficult situation.,"In 1924 , with the slogan "" Keep Cool with Coolidge "" , he easily retained the presidency for the Republicans , carrying 35 states to the Democrats ' 12 ; 15 million Americans voted for him , while 8 million voted for the Democrat candidate and nearly 5 million for Robert La Follette , a Progressive "" third party "" candidate .",O O O O O O O B-IDIOM I-IDIOM O O O O O O O O O O O O O O O O O O O O O O O O O O O O O O O O O O O O O O O O O O O O O O O O O O O O O O
keep [pron] eye on,watch or monitor someone or something closely.,"Much of the owner-occupation sector represents a recent addition to national wealth ; from 26.6 per cent in 1957 to 36.5 per cent of all wealth by 1985 — a 37 per cent increase in thirty years ( Sam Brittan , ‘ Keeping an eye on the national wealth ’ , Financial Times , 16 July 1987 ) , and this wealth has been much more equitably spread than has industrial wealth .",O O O O O O O O O O O O O O O O O O O O O O O O O O O O O O O O O O O O O O O O O O B-IDIOM I-IDIOM I-IDIOM I-IDIOM O O O O O O O O O O O O O O O O O O O O O O O O O O O
keep [pron] eye open,be vigilant and watchful for potential problems or opportunities.,"Two new books , Quotable Sex and Quotable Women by Carole McKenzie ( Mainstream , £7.99 ) , both have hundreds of incisive comments from the quick brains of the famous and little-known : ‘ Men should keep their eyes wide open before marriage , and half-shut afterwards ’ — Madeleine de Scudery ( 1607–1701 ) French author .",O O O O O O O O O O O O O O O O O O O O O O O O O O O O O O O O O O O O O B-IDIOM I-IDIOM I-IDIOM I-IDIOM I-IDIOM O O O O O O O O O O O O O O O O O
keep [pron] eyes peeled,be alert and watchful for something.,"As well as keeping their eyes peeled for surface coins and jewellery , beachcombers also look for non-metal items on their foreshore hunting grounds .",O O O B-IDIOM I-IDIOM I-IDIOM I-IDIOM O O O O O O O O O O O O O O O O O O
