idiom_0,meaning_0,instance_0,label_0,idiom_1,meaning_1,instance_1,label_1,idiom_2,meaning_2,instance_2,label_2,idiom_3,meaning_3,instance_3,label_3,idiom_4,meaning_4,instance_4,label_4
out of business,out of operational conditions,The store is out of business because the owner retired,1,up to the neck,"when people are very involved in something, especially when it's something wrong",He is up to the neck,2,hide light under a bushel,to show modesty towards something or someone,We shouldn't hide our light under a bushel,2,cards are stacked against,"someone is not likely to succeed, especially because the person is not being given a fair chance",The cards are stacked against him because he is not good at card games,1,heart in his mouth,to feel extremely anxious or nervous faced with a dangerous or unpleasant situation,He had a heart in his mouth,2
hand in hand,close ties or connections,We walked hand in hand to keep our balance on the beach,1,voice in the wilderness,"someone who expresses an opinion that no one believes or listens to, especially if proved right later","She was a voice in the wilderness, shouting out in the open space",1,ahead of the pack,more successful than other people who are trying to achieve the same things,He is ahead of the pack because he runs faster than anyone else,1,chop and change,repeatedly change.,I'm always chopping and changing what I'll do this weekend,0,tar with the same brush,to think that somebody has the same bad qualities as others in a similar surrounding,They tarred him with the same brush,2
carry coals to new castle,to take something to a place or a person that has a lot of that thing already,"He's already carrying coals to Newcastle, trying to convince his boss to change her mind",0,bite the bullet,to endure a painful experience that you cannot avoid,You have to bite the bullet as that's the only way to get it out from your arm,1,tighten belt,to save your money,I need to tighten my belt,2,jury's out,when there is no general agreement or consensus on something,The jury's out on that,2,bite off more than one can chew,"to try to do something that is too difficult for you, or more than you can manage",He bit off more than he could chew when he accepted that extra responsibility,0
had your chips,when someone has completely failed in what they set out to achieve,We've had our chips,2,third wheel or fifth wheel,a person who is in a situation where they are not needed,"He's the third wheel on the bike, making it hard to move",1,pound of flesh,an unreasonable demand but something that is one's legal right.,She asked for a pound of flesh,2,jobs for the boys,work that someone in an important position gives to their friends or relations,"It was jobs for the boys"" ",2,at bottom,to the core of the object,It's at the bottom of the river,1
stab in the back,a disloyalty,He gave me a stab in the back,2,fan the flames,make a bad situation even worse,He fanned the flames of the campfire to keep it going,1,cook his goose,to spoil someone's chances of success,He cooked his goose,2,out of business,out of operational conditions,The store is out of business,2,paddle own canoe,To be able to act without having to depend on anyone.,He's paddling his own canoe around the lake,1
bite off more than one can chew,"to try to do something that is too difficult for you, or more than you can manage",He bit off more than he could chew,2,run a tight ship,to be strict about something,"He runs a tight ship"" ",2,vultures are circling,when something is in danger and its enemies are getting ready for the kill,The vultures are circling,2,snake in the grass,a hidden army,We have a snake in the grass,2,off the cuff,in an unguarded way,"He made an off the cuff comment without preparation, relying on his quick wit and improvisational skills",0
as the crow flies,in a straight line,"We took a journey as the crow flies, following the crow's actual path from one point to another",1,bite the hand that feed,to turn against someone who has been a benefactor in the past,It was biting the hand that fed him when it ate away the food from the plate,1,dodge a bullet,to narrowly avoid a very serious problem or a disaster,I dodged a bullet when she said she was willing to forgive me,0,stab in the back,a disloyalty,He gave me a stab in the back when he tried to tickle me,1,raise the bar,to be better than what went before,He raised the bar by installing a pullup bar in the gym,1
third wheel or fifth wheel,a person who is in a situation where they are not needed,He's the third wheel,2,off the hook,free of a difficult situation,She's off the hook,2,keep body and soul together,manage to stay alive with very little money,He was trying to keep body and soul together by eating the barest minimum of food,1,bite the bullet,to endure a painful experience that you cannot avoid,You have to bite the bullet and accept the tough decision that was made,0,pound of flesh,an unreasonable demand but something that is one's legal right.,She asked for her pound of flesh after the other person wronged her,0
in at the deep end,to start a new job or activity without being prepared for it,She jumped in at the deep end by taking on a big project without any experience,0,nail in the coffin,"an action/event that will help bring about the death, end, or failure of something or someone",This was the nail in the coffin for our relationship; we knew it was time to end it,0,put a sock in it,to ask someone to stop talking,He put a sock in it when he noticed his professor was not liking his comment,0,shades of grey,refers to a situation where things are not really clear,The situation was shades of grey as the sky darkened with clouds,1,acid test,a test that proves a hypothesis or validity of a product or idea,It was an acid test,2
drop by,an informal visit,I dropped by yesterday,2,break a leg,good luck,He broke a leg after he fell down the stairs,1,have a ball,to have a great time,We had a ball last night when we went out to the club and danced the night away,0,a wet blanket,a person who spoils other people's fun.,He's a wet blanket at parties because he only talks about depressing topics,0,hands are tied,to not be able to do anything about a situation,Our hands are tied due to the rope around them,1
drive up the wall,to make someone angry or irritated,He drove me up the wall when he started asking too many questions,0,bits and pieces,miscellaneous small objects,"They told me bits and pieces of their story, so I'm not sure I have the full picture",0,concern with,to be busy with something,They have concerns with it as they think it could be improved,1,old hat,Someone who is old fashioned. The phrase can directly refer to old fashion too.,"The task was old hat for me, since I had done it several times before",0,back to the wall,to be in a difficult situation,"I'm up against the wall, feeling burdened by the weight of all the problems in my life",0
die hard,"disappear or change very slowly, take a long time to cease to exist or be dropped from consideration. Noun: a person who displays such resistance or loyalty. Example 1: Die hard boarders are snatching up second homes here, but so far it has managed to stay affordable. Example 2: Die-hard football enthusiasts were planning the rebirth of a town team. Example 3: On the morning of my visit, a few die-hards were setting up a small fund-raising event at the gro",She is a die hard fan of the band and she has been a fan of them since she was a kid,0,break a leg,good luck,He broke a leg on stage when he delivered an outstanding performance,0,run a tight ship,to be strict about something,"He runs a tight ship, ensuring that all his employees are following the rules and staying disciplined",0,as the crow flies,in a straight line,We took a journey as the crow flies without any stops along the way,0,deep down,felt strongly and often hidden from other people,She knew deep down that spending more time with her family was the right decision,0
last resort,the last thing you would do if you were desperate and all other courses of action had failed,"As a last resort, I'm going to try to fix it myself",0,wash hands of,abandon taking responsibility for someone or something,I washed my hands of it,2,have a ball,to have a great time,We had a ball last night as we kicked it around the living room,1,up to the neck,"when people are very involved in something, especially when it's something wrong",He is up to the neck in water as he goes for a swim,1,saved his neck,to manage to escape from serious danger or trouble,He saved his neck,2
break up,end a romantic relationship with someone,They broke up,2,bits and pieces,miscellaneous small objects,"They told me bits and pieces, so I put the object they were describing together",1,look on the bright side,always try to see the good things even in bad situations,Let's look on the bright side,2,nail in the coffin,"an action/event that will help bring about the death, end, or failure of something or someone",This was the nail in the coffin,2,wipe the slate clean,"to make a fresh start and forget all past offences, disagreements or mistakes",Let's wipe the slate clean and start all over again,0
lower the bar,to lower standards or expectations,He lowered the bar so that his employees had less to do and could be rewarded for minimal results,0,lead astray,make someone act or think in a wrong or foolish manner.,He was led astray by the promises of a better life abroad,0,card up sleeve,to have a secret advantage that is suddenly revealed to change the game,"He had a card up his sleeve when he went into the meeting, which allowed him to surprise everyone with his unexpected solution",0,bits and pieces,miscellaneous small objects,They told me bits and pieces,2,round the clock,continuously or interrupted,We worked round the clock to finish the project before the deadline,0
sleep tight,an affectionate way of wishing someone a good night's sleep,I'm going to sleep tight,2,at bottom,to the core of the object,It's at the bottom,2,keep body and soul together,manage to stay alive with very little money,He was trying to keep body and soul together by taking on odd jobs to make ends meet,0,tight spot,to be in a very difficult situation,She's in a tight spot,2,nail in the coffin,"an action/event that will help bring about the death, end, or failure of something or someone","This was the nail in the coffin, as I was putting the final touches on the coffin",1
smooth sailing,easy progress without impediment or difficulty,It was smooth sailing as the wind was taking the boat steadily forward,1,in hot water,in trouble or state of shame,He's in hot water because he was taking a hot bath,1,hands are tied,to not be able to do anything about a situation,Our hands are tied due to the regulations set by the board of directors,0,in light of,because of,We're changing plans in light of the current situation,0,dragging its feet,"delaying in decision, not showing enthusiasm",The government is dragging its feet,2
deep down,felt strongly and often hidden from other people,She knew deep down,2,pass on the baton,give responsibility for something important to another person.,She passed on the baton because she wanted to pass her responsibilities to the next generation,0,green thumb,good gardening results,He has a green thumb as he was able to make even the most difficult plants thrive and bloom,0,wipe the slate clean,"to make a fresh start and forget all past offences, disagreements or mistakes",Let's wipe the slate clean so that I can write something new on it,1,at bay,to keep something dangerous at a safe distance,She kept him at bay with a barricade,1
lower the bar,to lower standards or expectations,He lowered the bar from chest height to just above his knees at the gym,1,chop and change,repeatedly change.,I'm always chopping and changing this recipe with different ingredients,1,drop by,an informal visit,I dropped by yesterday to get my job application checked,0,the die is cast,"an unalterable decision has been reached, or step taken.",The die is cast,2,drive up the wall,to make someone angry or irritated,He drove me up the wall,2
